vd_salePhone,vd_serviceCode,vd_dealerName,vd_longitude,vd_address,vd_latitude,vc_name,vd_url,vd_dealerCode,vd_dealerType,vd_city,vd_province,vd_postCode,vd_fax,vp_name,vd_id
0512-68081888,,苏州市国懋汽车销售服务有限公司,120.565600,苏州市高新区塔园路111号,31.289397,苏州,,S932014,1,93,13,215000,,J 江苏,415
0512-63988600,,苏州市德宝车业有限公司,120.681074,江苏省吴江市经济开发区庞北路东侧,31.180895,苏州,,S732054,1,93,13,215200,,J 江苏,534
0512-67685888,,苏州德诚汽车销售服务有限公司,120.679225,苏州市吴中经济开发区尹南路（原兴郭路）399号,31.239132,苏州,,S732080,1,93,13,,,J 江苏,896
0512-86867666,,苏州元通汽车销售服务有限公司,120.557984,苏州高新区塔园路398号 ,31.331759,苏州,,S732085,1,93,13,,,J 江苏,978
15050295772,,苏州市德宝车业有限公司平望分公司,120.656715,苏州市平望镇s227省道东侧新春纺织有限公司一层,30.947431,苏州,,S732054M1,2,93,13,,,J 江苏,1081
0510-87867222,,宜兴市广海元汽车销售服务有限公司,119.840671,宜兴经济开发区锡宜公路东侧江旭集团对面,31.410538,无锡,,S732043,1,94,13,214214,,J 江苏,7
0510-85437771-801,,无锡市新纪元众友汽车销售服务有限公司,120.350146,无锡市崇安区学前东路尤渡里东方汽车二城内,31.588652,无锡,,S732040,1,94,13,214000,,J 江苏,8
0510-85703000              ,,无锡申荣汽车有限公司,120.255867,无锡市梁溪路张巷98号,31.565718,无锡,,S932018,1,94,13,214063,,J 江苏,89
0510-82122563 ,,无锡东方荣昌汽车销售服务有限公司,120.40894,无锡市新区金城东路新的东方汽车城内,31.567853,无锡,,S732007,1,94,13,214000,,J 江苏,252
 0510-86401666,,江阴市全顺海宏汽车销售服务有限公司,120.320679,江苏省江阴市澄扬路59号,31.889564,无锡,,S732045,1,94,13,214400,,J 江苏,449
0510-83219888,,无锡宝达汽车销售服务有限公司,120.236591,无锡市惠山区钱桥街道江海西路南侧江南机械西侧,31.622137,无锡,,S732068,1,94,13,214151,,J 江苏,719
0510-81705555,,宜兴新东方汽车销售服务有限公司,119.792473,江苏省宜兴经济开发区融达汽车城西大门加油站南侧180米,31.393452,无锡,,S732084,1,94,13,,,J 江苏,912
0510-81608181,,江阴市海隆汽车销售服务有限公司,120.20464,江阴市五星路1688号（夏港国际汽车城）,31.904604,无锡,,S732083,1,94,13,,,J 江苏,952
0516-83667788,,徐州金茂汽车贸易有限公司,117.230054,徐州市东三环路广山段公安驾校南侧,34.275149,徐州,,S732033,1,96,13,221000,,J 江苏,90
0516-66660888,,徐州金源汽车服务有限公司,117.216262,徐州市王场（复兴北路东侧）,34.29839,徐州,,S732058,1,96,13,221000,,J 江苏,565
0516-68879888,,徐州金泉汽车贸易有限公司,116.95057,江苏省沛县新城区正阳路东侧，韩信路南侧,34.757943,徐州,,S232001,1,96,13,221600,,J 江苏,786
0516-68065888,,徐州金宇汽车贸易有限公司 ,117.991307,江苏省睢宁县东环岛汽车站西门南侧,33.904714,徐州,,S232002,1,96,13,,,J 江苏,854
0516-86603888,,邳州大中汽车销售服务有限公司,117.995073,江苏省邳州市环城北路汽车城（新城汽车站北侧）一汽-大众4S店,34.382804,徐州,,S732088,1,96,13,,,J 江苏,1044
0516-88780777,,新沂大中汽车贸易有限公司,118.3599,江苏省新沂市唐店镇街口249省道西侧 ,34.296981,徐州,,S232013,1,96,13,,,J 江苏,1063
0513-85616666,,南通新城集团有限公司,120.812225,南通市城港路139号,32.039848,南通,,S732048,1,97,13,226003,,J 江苏,255
0513-85925888,,南通鑫湖汽车贸易服务有限公司,120.955203,江苏省南通市经济技术开发区星湖大道1075号,31.928299,南通,,S732050,1,97,13,226010,,J 江苏,456
0513-87778888,,如皋神州汽车销售服务有限公司,120.554185,如皋市如城镇惠政西路纪庄社区11组（如皋汽车城有限公司内）,32.362262,南通,,S732064,1,97,13,226500,,J 江苏,684
0513-55881188,,南通文峰伟嘉汽车销售服务有限公司,120.884939,南通市工农北路599号,32.070722,南通,,S732062,1,97,13,226000,,J 江苏,729
0513-68508000,,如东德众汽车销售服务有限公司,121.169308,江苏省如东县掘港镇南环路88号,32.298748,南通,,S732081,1,97,13,,,J 江苏,903
0513-83209666,,启东常众文峰汽车销售服务有限公司,121.612643,江苏省启东市汇龙镇人民西路3911号 ,31.832362,南通,,S732077,1,97,13,,,J 江苏,923
0513-81812222,,海安德品汽车有限公司,120.407736,海安县海安镇北川西路7号 ,32.488586,南通,,S732086,1,97,13,,,J 江苏,962
0513-55083888,,南通大生众和汽车销售服务有限公司,120.938014,南通市通富北路999号,32.036553,南通,,S732063,1,97,13,,,J 江苏,1064
13921649633,,南通大生众和汽车销售服务有限公司通州分公司,120.989614,南通市通州区北二环路南侧（金沙镇育才路3号）,31.923294,南通,,7583208A1,4,97,13,226000,,J 江苏,1151
0518-85913666,,连云港康华汽车销售服务有限公司,119.221009,连云港海州开发区瀛州南路50-1号,34.575991,连云港,,S732032,1,98,13,222000,,J 江苏,401
0518-82376999,,连云港康瑞汽车销售服务有限公司,119.310027,连云港市开发区东方大道南,34.718945,连云港,,S732073,1,98,13,222000,,J 江苏,795
0518-88519666/0518-88788061,,连云港康瀛汽车销售有限公司,119.224733,江苏省连云港市灌云县经济开发区境内324省道南侧,34.276928,连云港,,S232008,1,98,13,,,J 江苏,883
0518-87181666,,连云港康泽汽车销售有限公司,119.121372,江苏省连云港市赣榆县青口镇南街社区华中南路西侧 ,34.825748,连云港,,S232011,1,98,13,,,J 江苏,917
0518-87268088,,连云港康锦汽车销售有限公司,118.792125,连云港市东海县奔牛转盘向南4公里（开发区海宁皮革城对面）,34.516576,连云港,,S232010,1,98,13,,,J 江苏,963
0515-88186502,,江苏中联汽车销售服务有限公司,120.137938,盐城市世纪大道２８８号,33.33672,盐城,,S732025,1,101,13,224055,,J 江苏,99
51588537888,,盐城鑫湖贸易有限公司,120.230328,江苏省盐城经济技术开发区新都东路31号,33.382425,盐城,,S732061,1,101,13,224007,,J 江苏,797
0515-89515566,,东台宝达汽车销售服务有限公司,120.424952,东台市城东新区经一南路1号（永宁国际汽车城内）,32.865746,盐城,,S232012,1,101,13,,,J 江苏,864
0515-89222188,,射阳宝达汽车销售服务有限公司,120.222346,江苏省射阳县经济开发区汇通汽贸城西侧（一汽大众4S店）,33.768551,盐城,,S232016,1,101,13,,,J 江苏,932
13814349669,,江苏中联汽车销售服务有限公司阜宁分公司,119.8276,阜宁县开发区大道20号阜宁星辰汽车城内,33.78565,盐城,,S732025M1,2,101,13,,,J 江苏,1086
025-85330666,,南京朗驰集团苏润汽车销售服务有限公司,118.826201,南京市栖霞大道２号,32.122097,南京,,S732021,1,102,13,210028,,J 江苏,97
025-52886622,,江苏华海南众汽车销售有限公司,118.805453,南京市卡子门大街62号,31.992511,南京,,S732066,1,102,13,210012,,J 江苏,253
025-85436861,,江苏苏舜华德汽车销售服务有限公司,118.816271,南京市玄武区红山路56号,32.090113,南京,,S732028,1,102,13,210028,,J 江苏,254
025-68530888/68530999,,南京协众东麒汽车有限公司,118.883391,南京市江宁区东山街道高桥工业集中区东麒路,31.986483,南京,,S732051,1,102,13,210007,,J 江苏,526
025-52602288,,江苏协众晨友汽车有限公司,118.817494,南京秦淮区大明路130号,32.013765,南京,,S732091,1,102,13,,,J 江苏,829
025-52178888,,南京协众瑞东汽车有限公司,119.074372,江苏省南京市江宁区汤山街道汤山大街,32.025035,南京,,S732069,1,102,13,,,J 江苏,836
025-57268888,,南京溧水协众汽车销售服务有限公司,119.019456,南京市溧水区经济开发区团山西路27号 ,31.691819,南京,,S232015,1,102,13,,,J 江苏,936
025-68720011,,南京东连香江汽车销售服务有限公司,118.859002,南京市江宁经济开发区蓝天路238号 ,31.779028,南京,,S732090,1,102,13,,,J 江苏,965
025－52206688,,南京江北协众汽车销售服务有限公司,118.705771,南京市浦口区沿山东路泰山汽车4S园9-5号 ,32.143743,南京,,S732087,1,102,13,,,J 江苏,999
18151659777,,南京协众东麒汽车有限公司高淳分公司,118.870412,江苏省南京市高淳区淳溪镇汶溪路163号-18,31.344957,南京,,S732051M1,2,102,13,,,J 江苏,1112
0514-87955555,,江苏金太阳汽车销售服务有限公司,119.424290,扬州市扬子江中路180号,32.365056,扬州,,S732037,1,103,13,225009,,J 江苏,100
0514-87553333,,扬州金通汽车销售服务有限公司,119.612579,江苏省扬州市江都区汽车城5号地块101号,32.438651,扬州,,S732065,1,103,13,225200,,J 江苏,791
0514-87225555,,扬州金迈汽车销售服务有限公司,119.178749,江苏省仪征市真州镇曹山路19号,32.305551,扬州,,S232007,1,103,13,,,J 江苏,892
0514-87391111,,江苏金太阳瑞众汽车贸易有限公司,119.38467,扬州市邗江区西湖镇金槐村饶庄组 ,32.455633,扬州,,S732078,1,103,13,,,J 江苏,929
0511-85217888,,江苏华跃汽车有限公司,119.476402,江苏省镇江市润州区官塘桥路99号,32.178521,镇江,,S732031,1,104,13,212004,,J 江苏,102
0511-86059999,,江苏德大汽车有限公司,119.608959,江苏省丹阳市开发区黄金塘东路1号,32.045055,镇江,,S732059,1,104,13,212310	,,J 江苏,640
0511-89666666,,镇江德豪汽车有限公司,119.508464,镇江新区丁卯武将路16号,32.188385,镇江,,S732071,1,104,13,212000,,J 江苏,810
15996800522,,江苏华跃汽车有限公司句容分公司,119.160155,江苏省镇江市句容市洪武路三里井,31.968584,镇江,,7583296A1,4,104,13,212000,,J 江苏,1146
0512-52833377,,常熟市众成汽车销售有限公司,120.805133,常熟新厍村汽车市场东100米,31.641364,常熟,,S732015,1,105,13,215500,,J 江苏,93
0512-52020000,,常熟德润汽车销售服务有限公司,120.757045,江苏省常熟市深圳路16号,31.697613,常熟,,S732070,1,105,13,215500,,J 江苏,744
0527-81880777,,宿迁大中汽车服务有限公司,118.240492,宿迁市宿城区双庄镇双庄街南红海路西侧,33.936011,宿迁,,S732046,1,213,13,223800,,J 江苏,464
0527-83776666,,沭阳大中汽车服务有限公司,118.805174,沭阳县沭城镇学院路北侧永康路东侧,34.092818,宿迁,,S232003,1,213,13,,,J 江苏,882
0527-86688588,,宿迁中瑞汽车服务有限公司,118.192087,江苏省宿迁市泗洪县宁徐路西侧（国际汽车城）A区 ,33.415123,宿迁,,S232014,1,213,13,,,J 江苏,937
0517-88557777/88558066,,淮安驰祥汽车销售服务有限公司,118.614029,江苏省淮安市盱眙县维桥国际汽车城（盱马路北侧）,33.012737,淮安,,S232009,1,242,13,211700,,J 江苏,67
0517-80877755,,淮安康润汽车销售服务有限公司,33.620762,江苏省淮安市清河新区水渡口大道123号,33.620762,淮安,,S732055,1,242,13,223001,,J 江苏,564
0523-86999777,,泰州金太阳汽车贸易有限公司,119.906391,江苏省泰州市国际汽车城,32.427690,泰州,,S732057,1,276,13,225300,,J 江苏,635
0523-88985666,,泰州金邦汽车销售服务有限公司,120.119714,泰州市姜堰区梁徐汽车城新328国道与双登大道交汇处 ,32.486548,泰州,,S232005,1,276,13,,,J 江苏,954
0523-87083888,,泰州金翱汽车销售服务有限公司,120.055413,泰兴市振兴路与镇海路交界处北侧（汽贸城5号） ,32.205322,泰州,,S732075,1,276,13,,,J 江苏,990
0523-89187888,,泰州金坤汽车销售服务有限公司,120.234884,江苏省靖江市中洲西路18号（靖江国际汽贸城内） ,32.006033,泰州,,S732076,1,276,13,,,J 江苏,991
0523-83881777,,泰州金浦汽车销售服务有限公司,119.853443,江苏省兴化市临城镇科技工业园兴化大道西侧,32.892778,泰州,,S232004,1,276,13,,,J 江苏,1013
0512-53776600,,太仓市森联汽车销售服务有限公司,121.096715,太仓市经济开发区北京西路11号,31.48212,太仓,,S732060,1,277,13,215400,,J 江苏,636
0514-87757777,,扬州金沪汽车销售服务有限公司,119.474225,江苏省高邮市珠光路888号,32.768081,高邮,,S232006,1,328,13,,,J 江苏,838
0795-3567168,,江西佳辉汽车贸易服务有限公司,114.401235,宜春市宜春大道（汽车北站旁）,27.838771,宜春,,S736008,1,107,14,336000,,J 江西,166
0795-2096999,,高安华宏汽车有限公司,115.407114,江西省高安市320国道858公桩（站前路以东）,28.463444,宜春,,S236002,1,107,14,,,J 江西,1054
13870573999,,江西佳辉汽车贸易服务有限公司丰城市分公司,114.401441,江西丰城市紫去南大道799号（新城区汽车总站旁）,27.83873,宜春,,S736008M1,2,107,14,,,J 江西,1107
0791-86231169,,江西协众汽车发展有限公司,115.912871,江西省南昌市省政府大院北二路102号,28.683834,南昌,,S936005,1,109,14,330046,,J 江西,163
0791-8216666,,南昌欧亚汽车销售有限公司,115.934905,江西省南昌市洪都中大道135号,28.668864,南昌,,S736005,1,109,14,330002,,J 江西,164
0791-8461111,,江西华宏名众汽车有限公司,115.922850,南昌市洪都南大道28号,28.640648,南昌,,S736017,1,109,14,330001,,J 江西,623
0791-88192778,,南昌恒信一路汽车销售服务有限公司,115.960891,南昌市新南大道与昌南大道交界处昌东国际汽车城 ,28.601902,南昌,,S736024,1,109,14,,,J 江西,996
0792-8378918,,九江宏达汽车贸易有限公司,115.953265,江西省九江市开发区九瑞大道120号国际会展中心斜对面,29.709534,九江,,S736007,1,110,14,332000,,J 江西,165
0792-8911888,,九江九源汽车销售服务有限公司,116.077935,江西省九江市庐山区庐山大道中段（候白垄路以南）,29.675577,九江,,S736020,1,110,14,,,J 江西,930
13755290821,,九江宏达汽车贸易有限公司修水分公司,114.526083,江西省九江市修水县良塘区鹏创汽车城4号楼,29.006072,九江,,S736007M1,2,110,14,,,J 江西,1072
15870806558,,九江宏达汽车贸易有限公司瑞昌分公司,115.702647,九江瑞昌市赛湖路西侧杨林湖大街北侧,29.680233,九江,,S736007M2,2,110,14,,,J 江西,1104
0799-6679668,,萍乡市永安昌荣实业有限公司,113.891475,萍乡市安源区十里铺319国道与萍高公路交汇处,27.625055,萍乡,,S736022,1,111,14,,,J 江西,834
0797-8081666,,赣州金涛汽车销售服务有限公司,114.893706,江西省赣州市经济技术开发区金潭大道,25.849797,赣州,,S736013,1,216,14,341400,,J 江西,482
0797-6688222,,江西晨元汽车销售服务有限公司,114.824799,江西省赣州市南康区龙岭镇赣南汽车城内B-02地块,25.74151,赣州,,S236001,1,216,14,,,J 江西,1031
18970139521,,赣州金涛汽车销售服务有限公司兴国分公司,115.371744,兴国县工业园区国兴汽车大市场内6#栋F1013-F1020 F1036-F1044号商铺,26.325078,赣州,,S736013M1,2,216,14,,,J 江西,1096
0796-2196568,,吉安汇成万方汽车销售服务有限公司,115.04 ,江西省监事青原区青原大道南物流汽贸中心5#地块,27.13,吉安,,S736028,1,267,14,343000,,J 江西,1125
0796-8190000,7583628,吉安华宏汽车有限公司,114.991173,江西省吉安市吉州区长塘镇城北汽车站,27.146284,吉安,,s736030,1,267,14,343000,,J 江西,1158
0701-5861966,,鹰潭华宏汽车有限公司,116.985061,江西省鹰潭市余江县中童镇乘龙村（手拉手国际汽车城内）,28.303264,鹰潭,,S736021,1,342,14,,,J 江西,904
0790-6850002,,新余邦田汽车服务有限公司,114.869398,江西省新余市仙女湖中心物流园区管理局,27.801922,新余,,S736029,1,373,14,338000,,J 江西,1134
0417-2951111-1,,营口红运汇众汽车销售服务有限公司,122.288627,辽宁省营口市渤海大街东段97号,40.673617,营口,,S721027,1,1,1,115000,,L 辽宁,1
0417-5543333,,营口红运顺众汽车销售服务有限公司,122.128266,辽宁省营口市鲅鱼圈区熊岳高速路口南红运汽车城内,40.232569,营口,,S221006,1,1,1,115007,,L 辽宁,818
0411-85570928          ,,瓦房店市顺发物资商贸有限公司,121.947891,辽宁省瓦房店市西长春路西段23号,39.642005,瓦房店,,S721018,1,2,1,116300,,L 辽宁,20
024-56590990,,抚顺和昆汽车销售服务有限公司,123.770203,辽宁省抚顺市望花区丹东路西段29号（新钢北门对面）,41.855971,抚顺,,S721035,1,3,1,113001,,L 辽宁,522
13470585627,,抚顺和昆汽车销售服务有限公司清原分公司,124.946065,清原县莱河路与白云街交汇处,42.100505,抚顺,,S721035M1,2,3,1,,,L 辽宁,1120
024-74012222,,铁岭市顺峰（集团）汽车销售服务有限公司,123.846871,铁岭市银州区柴河街南段35号,42.281829,铁岭,,S721028,1,4,1,112000,,L 辽宁,383
024-72236688,,铁岭和成汽车销售服务有限公司,123.771863,铁岭经济开发区机动车交易市场园区长江东路9号,42.222768,铁岭,,S721034,1,4,1,112000,,L 辽宁,567
13700104231,,铁岭和成汽车销售服务有限公司昌图分公司,124.109006,昌图县迎宾路翰林院小区6#楼16、17、18、19号商业网点,42.776386,铁岭,,S721034M1,2,4,1,,,L 辽宁,1087
0427-8266755,,盘锦隆达汽车产品销售服务有限公司,122.056656,辽宁省盘锦市经济开发区辽河路,41.158571,盘锦,,S721030,1,5,1,124000,,L 辽宁,281
0427-8590000,,盘锦伯骏汽车销售服务有限公司,122.079558,辽宁省盘锦市兴隆台区兴油街与芳草路交汇处（油田供应岗）,41.164548,盘锦,,S721049,1,5,1,,,L 辽宁,1050
024-25835555,,沈阳合众汽车服务有限公司,123.301769,辽宁省沈阳市于洪区巢湖街2号,41.802798,沈阳,,S721025,1,6,1,110141,,L 辽宁,17
024-88442688 ,,辽宁惠华汽车集团有限公司,123.512214,辽宁省沈阳市大东区东陵西路12号,41.820488,沈阳,,S721024,1,6,1,110043,,L 辽宁,212
024-62138888 ,,辽宁和兴大众汽车销售服务有限公司,123.370896,沈阳市铁西区北二中路18-1号,41.819091,沈阳,,S921003,1,6,1,110025,,L 辽宁,214
024-83504555,,沈阳和昊汽车销售服务有限公司,123.394926,沈阳市和平区胜利南街74号,41.79057,沈阳,,S721031,1,6,1,110001,,L 辽宁,448
024-25283333,,沈阳市庞大一众汽车销售有限公司,123.247742,沈阳市经济技术开发区沈辽西路115号,41.746823,沈阳,,S721037,1,6,1,110142,,L 辽宁,585
024-87108111,,沈阳惠华新业汽车销售服务有限公司,123.411493,辽宁法库经济开发区,42.498830,沈阳,,S221001,1,6,1,110400,,L 辽宁,696
024-27851116,,辽宁惠华新业集团新民汽车销售服务有限公司,104.201912,新民市外环路188号,35.867568,沈阳,,S221002,1,6,1,110300,,L 辽宁,778
024-62913333/62913888,,辽宁惠华新业集团辽中汽车销售服务有限公司,122.847883,辽宁省沈阳近海经济区近海南大街5号 ,41.515619,沈阳,,S221003,1,6,1,,,L 辽宁,950
00000000000,,沈阳合众汽车服务有限公司,123.487166,辽宁省沈阳市沈河区万柳塘路12号6门，7门,41.793941,沈阳,,S721025S1,3,6,1,110000,,L 辽宁,1155
0416-2667099                  ,,锦州通用汽车销售服务有限公司,121.143457,锦州市高新区南广路216号,41.087315,锦州,,S721019,1,7,1,121000,,L 辽宁,21
0416-2667155,,锦州川达汽车销售有限公司,121.142743,辽宁省锦州市太和区锦南路85-1号,41.086854,锦州,,S221007,1,7,1,121000,,L 辽宁,1129
0429-3183605,,葫芦岛市维立达汽车服务有限公司,120.863424,葫芦岛市龙港区龙湾大街60号,40.731270,葫芦岛,,S721013,1,8,1,125000,,L 辽宁,18
0418-2280488,,阜新永生工贸发展有限公司,121.774867,阜新市太平区新南环路39号,42.017338,阜新,,S721007,1,9,1,123000,,L 辽宁,203
0418-2162888,,阜新和利汽车销售服务有限公司,121.621736,阜新市经济开发区高新技术园区D路东三路北,42.009126,阜新,,S721036,1,9,1,123000,,L 辽宁,566
18241819955,,阜新和利汽车销售服务有限公司彰武分公司,122.525716,彰武县新兴路与G101交汇处,42.377177,阜新,,S721036M1,2,9,1,,,L 辽宁,1077
0415-2251768,,丹东曙光新天地汽车销售服务有限公司,124.352735,丹东市振兴区花园路51-18号,40.129657,丹东,,S721044,1,10,1,,,L 辽宁,826
0411-87844026,,大连汽贸集团汽车销售服务有限公司,121.707594,大连市金州区胜利路111号,39.100072,大连,,S921002,1,11,1,116100,,L 辽宁,215
0411-88010000-802,,大连通孚祥汽车贸易有限公司,121.846433,大连保税区中港北一路9号,39.047284,大连,,S721029,1,11,1,116033,,L 辽宁,452
0411-39011777,,大连禾众汽车销售服务有限公司,121.442528,大连市高新园区浩川园1号,38.852183,大连,,S721040,1,11,1,116000,,L 辽宁,743
0411-86602135,,大连弘鼎汽车销售服务有限公司,121.595032,大连市甘井子区华东路45号,38.978721,大连,,S721041,1,11,1,116031,,L 辽宁,774
0411-39621111,,大连中升汇众汽车销售服务有限公司,121.529207,辽宁省大连市甘井子区虹港路560号,38.967398,大连,,S721048,1,11,1,116039,,L 辽宁,816
0472-6198899,,大连中联伟业汽车销售有限公司,122.954051,辽宁省庄河市一环路一段999号,39.719661,大连,,S721043,1,11,1,116400,,L 辽宁,817
0412-8240088,,鞍山市中田汽车贸易有限公司,122.949261,辽宁省鞍山市铁西区西解放路195号,41.114269,鞍山,,S921017,1,12,1,114014,,L 辽宁,217
0412-7105111,,鞍山谛赢汽车销售服务有限公司,122.954019,鞍山市干山区西解放路东（达道湾镇吴三台子村）,41.150866,鞍山,,S721032,1,12,1,114014,,L 辽宁,509
0414-5995999/0414-5993888,,辽宁惠华集团本溪汽车销售服务有限公司,123.735109,辽宁省本溪市溪湖区彩北鲍家街,41.316382,本溪,,S721039,1,266,1,117000,,L 辽宁,608
0421-7191333,,辽宁惠华集团朝阳汽车销售服务有限公司,120.432061,朝阳市龙城区长江路6段558号,41.614095,朝阳,,S721038,1,272,1,122000,,L 辽宁,627
0421-7169555,,朝阳川达捷胜汽车销售服务有限公司,120.445044,辽宁省朝阳县柳城镇腰而营子村,41.511939,朝阳,,S721047,1,272,1,,,L 辽宁,1042
0419-3611111,,辽阳凯众汽车销售服务有限公司,123.220540,辽阳市宏伟区南环街二段,41.246104,辽阳,,S721033,1,308,1,111003,,L 辽宁,517
0419-8671111,,灯塔凯祥汽车销售服务有限公司,123.355,辽宁省灯塔市沈营公路外环西段南侧灯塔凯祥4s店,41.436637,辽阳,,S221004,1,308,1,,,L 辽宁,877
0476-4669807,,赤峰隆瑞商贸有限公司,118.969159,赤峰市敖汉旗新惠镇物流园区,42.299158,赤峰,,S215003,1,189,29,024300,,N 内蒙古,50
0476-8672188,,赤峰凯富达汽车服务有限公司,119.000434,内蒙古赤峰市红山区东郊村三组（新双拥杯东走三百米路北）,42.286176,赤峰,,S715011,1,189,29,024000,,N 内蒙古,298
0476-8280123,,赤峰坤驰汽车销售服务有限公司,118.921598,内蒙古赤峰市红山区桥北物流园区玉龙汽贸路001号,42.33526,赤峰,,S715032,1,189,29,024000,,N 内蒙古,771
0477-3995511,,鄂尔多斯市鑫安基业汽车销售有限责任公司,109.979560,鄂尔多斯市东胜区铁西新桥洞后第一家,39.827128,鄂尔多斯,,S715015,1,190,29,017000,,N 内蒙古,347
0477-3993222-1,,鄂尔多斯市鑫安汽车贸易服务有限责任公司,110.111106,鄂尔多斯鑫市东胜区铜川镇汽车博览园一汽大众4S店,39.796374,鄂尔多斯,,S715017,1,190,29,017000,,N 内蒙古,607
0477-3807899,,乌审旗鑫安亿恒汽车销售有限责任公司,108.805418,鄂尔多斯乌审旗嘎鲁图镇北汽配物流园区（一汽大众店）,38.576372,鄂尔多斯,,S215001,1,190,29,017000,,N 内蒙古,750
0471-3604177,,内蒙古亿阳汇众汽车销售有限公司,111.559587,内蒙古呼和浩特市金川开发区汇金道2号,40.805571,呼和浩特,,S715014,1,191,29,010080,,N 内蒙古,344
0471-3310968,,内蒙古利丰泰宇汽车服务有限公司,111.616423,内蒙古呼和浩特市回民区海拉尔西路利丰汽车文化广场,40.826625,呼和浩特,,S715021,1,191,29,010050,,N 内蒙古,453
0471--5272711,,内蒙古众和汽车销售服务有限公司,111.699164,呼和浩特市新城区兴安北路与北二环交汇处,40.870422,呼和浩特,,S715023,1,191,29,010050,,N 内蒙古,499
0471-5163888,,呼和浩特市庞大一众汽车销售服务有限公司,111.632980,呼和浩特市玉泉区南二环与云中路西南角,40.779332,呼和浩特,,S715027,1,191,29,010060,,N 内蒙古,674
0472-5100308,,包头德众汽车服务有限公司,109.872765,包头市稀土高新开发区幸福南路58号,40.637946,包头,,S715009,1,192,29,014030,,N 内蒙古,348
0472-2983366,,包头市惠众汽车服务有限公司,109.865215,内蒙古包头市青山区民族东路立交桥东100M路北,40.708748,包头,,S715033,1,192,29,014030,,N 内蒙古,631
0472-6198899,,包头庞大一众汽车销售服务有限公司,109.952362,包头市九原区210国道东哈屯高勒路南500米（铜厂院内）,40.600398,包头,,S715025,1,192,29,14060,,N 内蒙古,668
0470-8131777,,呼伦贝尔市华通汽车销售有限公司,119.80865,内蒙古呼伦贝尔市海拉尔区牙克石路,49.266744,呼伦贝尔,,S715016,1,193,29,021008,,N 内蒙古,45
0475-6337778,,通辽庞大一众汽车销售服务有限公司,122.229501,通辽经济技术开发区创业大道与阿古拉大街交汇处东南角,43.655211,通辽,,S715029,1,209,29,28000,,N 内蒙古,586
0475-6380922,,通辽市利丰泰宇汽车销售服务有限公司,122.321932,内蒙古通辽市科尔沁区霍林河大街东段利丰园区内,43.644201,通辽,,S715034,1,209,29,028000,,N 内蒙古,620
0478-8758888,,巴彦淖尔市航海汽车销售服务有限公司,107.458443,巴彦淖尔市临河区新华东街石化加油站旁边,40.77493,巴彦淖尔,,S715020,1,224,29,015000,,N 内蒙古,500
0473-6105601,,乌海市鑫安众诚汽贸有限公司,106.844412,内蒙古乌海市海勃湾区沃野路与林荫大道交汇处,39.707522,乌海,,S715022,1,243,29,16000,,N 内蒙古,568
