vd_salePhone,vd_serviceCode,vd_dealerName,vd_longitude,vd_address,vd_latitude,vc_name,vd_url,vd_dealerCode,vd_dealerType,vd_city,vd_province,vd_postCode,vd_fax,vp_name,vd_id
13526876536,,河南万通一汽贸易有限公司登封分公司,113.105727,河南省登封市少林大道东段韩村车友汽车城,34.458373,郑州,,S741004M1,2,52,7,,,H 河南,1102
0371-55230666,,郑州威佳众恒汽车销售服务有限公司,113.794456,郑州市郑东新区商都路圃田威佳汽车园一汽大众4S店,34.748115,郑州,,S741046,1,52,7,450000,,H 河南,1128
0377-61531188,,南阳众业汽车有限公司,112.598337,南阳市312国道（新检察院西200米路北）,33.031245,南阳,,S741027,1,53,7,473000,,H 河南,559
13782117690,,南阳众业汽车有限公司淅川分公司,112.59825,河南省南阳市淅川县上集镇西坪头大桥东200米淅川汽车新城,33.031297,南阳,,S741027M1,2,53,7,,,H 河南,1105
18623995559,,南阳众业汽车有限公司西峡分公司,112.523761,河南省南阳市西峡县人民路与东环路交叉口（原天地豪情）南500米路东一汽大众南阳众业西峡分公司,33.015211,南阳,,S741027M2,2,53,7,,,H 河南,1106
0394-8592288,,周口市和荣汽车销售服务有限公司,114.682601,河南省周口市川汇区北环路（太清路）东段,33.656611,周口,,S741026,1,238,7,466000,,H 河南,557
0394-8531888,,周口宏威汽车销售服务有限公司,114.721962,周口市交通大道东段路北（中原驾校西侧）,33.596522,周口,,S741045,1,238,7,466000,,H 河南,1132
0396-3831115,,驻马店市和美汽车销售服务有限公司,114.072116,河南省驻马店市华骏大道华骏车城中段,32.989642,驻马店,,S741024,1,239,7,463000,,H 河南,582
0375-7399999,,平顶山市华天汽车销售服务有限公司,113.321727,平顶山市神马大道与新华路交叉口西500米路北,33.724456,平顶山,,S741020,1,240,7,467000,,H 河南,560
0375-3919999,,平顶山吉祥地汽车销售有限公司,113.394917,平顶山市开发路与神马大道交叉口向东50米路南,33.725661,平顶山,,S741035,1,240,7,,,H 河南,850
0370-6060999,,商丘市众捷汽车销售有限公司,115.601679,商丘市金桥路与锦绣路交汇处西北角,34.450229,商丘,,S841002,1,253,7,476000,,H 河南,232
0370-5730505、5730888,,永城市华瑞汽车销售有限公司,116.443057,永城市东城区芒山路南段西侧化工路北段,33.915839,商丘,,S241004,1,253,7,476600,,H 河南,801
0370-4170999,,虞城县众捷汽车贸易物流有限公司,115.875071,虞城县工业大道与至诚六路交叉口西南角,34.44658,商丘,,S241006,1,253,7,,,H 河南,880
18603706555,,商丘市众捷汽车销售有限公司柘城分公司,115.601679,柘城县未来大道北侧,34.450229,商丘,,S841002M1,2,253,7,,,H 河南,1093
15249770771,,商丘市众捷汽车销售有限公司夏邑分公司,116.147632,夏邑县省道324与省道202交汇处东南角,34.241379,商丘,,S841002M2,2,253,7,,,H 河南,1094
15136094470,,商丘市众捷汽车销售有限公司民权分公司,115.138341,民权县迎宾西路与兴业路交叉口西北角汽车物流园区内,34.646171,商丘,,S841002M3,2,253,7,,,H 河南,1095
0370-6059100,7584136,商丘市万通汽车销售有限公司,115.69784,商丘市开发区星林路与车城路交叉口路东100米路北,34.391916617,商丘,,S741047,3,253,7,476000,,H 河南,2033
0398-2188222,,三门峡九都汽车有限公司,111.260772,三门峡市湖滨区交口乡侯桥村310国道涧河桥南路东,34.737276,三门峡,,S741025,1,274,7,472000,,H 河南,629
0398-8782111,,灵宝众诚汽车销售服务有限公司,110.894401,灵宝市开元大道路东 ,34.576302,三门峡,,S741042,1,274,7,,,H 河南,989
0376-6756000,,信阳合众汇金汽车销售服务有限公司,114.185811,信阳市工业城迎宾大道中段（原312国道招商委员会西60米）,32.130987,信阳,,S741028,1,278,7,464000		,,H 河南,644
0392-6892222,,鹤壁维尔娜汽车销售有限公司,114.320324,鹤壁市淇滨区泰山路与海河路交叉口东南口,35.770130,鹤壁,,S741029,1,298,7,458030,,H 河南,751
0898-66830320,,海南博世汽车服务有限公司,110.32828,海口市南海大道59号,20.001786,海口,,S746004,1,196,31,570216,,H 海南,412
0898-68603399,,海南博众汽车销售有限公司,110.280096,海南省海口市秀英区南海大道237号,20.002527,海口,,S746005,1,196,31,570125		,,H 海南,641
0898-38223366,,三亚长久博众汽车服务有限公司,109.606304,海南省三亚市吉阳镇吉阳大道68号,18.298964,三亚,,S746006,1,358,31,,,H 海南,1007
027-83990888,,武汉东富优诚汽车销售服务有限公司,114.192021,武汉市~口区古田一路32号,30.614355,武汉,,S942036,1,81,11,430000,,H 湖北,32
027-65600559,,武汉康顺集团汽车贸易有限公司,114.288978,武汉市江岸区经济开发区原黄浦科技园特3号,30.637453,武汉,,S942016,1,81,11,430019,,H 湖北,172
027-87384148,,湖北东富汽车工贸有限公司,114.370060,武汉市洪山区雄楚大街420号,30.515144,武汉,,S942017,1,81,11,430074,,H 湖北,173
027-86559288,,武汉富尔汽车销售服务有限公司,114.397498,武汉市洪山区仁和路和平村汽车产业园特5号,30.605446,武汉,,S942032,1,81,11,430000,,H 湖北,632
027-87906888,,武汉恒信众联汽车销售服务有限公司,114.445641,武汉东湖开发区光谷一路205号,30.492690,武汉,,S942034,1,81,11,430079,,H 湖北,773
027-84633666,,武汉恒信一通汽车销售服务有限公司,114.210301,湖北省武汉市汉阳区龙阳大道特8号,30.55357,武汉,,S942040,1,81,11,,,H 湖北,840
0714-5378888,,黄石市大桥汽车服务有限公司,114.991535,湖北省黄石市下陆区发展大道139号,30.218526,黄石,,S942022,1,82,11,435000,,H 湖北,380
0710-3338555,,襄阳华骏汽车销售服务有限公司,112.173991,湖北省襄樊市春园东路43号,32.090863,襄樊,,S942031,1,83,11,441000,,H 湖北,587
0717-6300818,,宜昌德顺汽车销售服务有限公司,111.354175,湖北省宜昌市东山开发区发展大道95号,30.745155,宜昌,,S942023,1,84,11,443000,,H 湖北,455
0717-4645818,,宜昌都顺汽车贸易有限公司,111.471763,宜都市陆城城河大道（头笔社区）（城东）,30.383034,宜昌,,S242001,1,84,11,,,H 湖北,881
0717-6861000,,宜昌恒信众联汽车销售服务有限公司,111.387021,宜昌市伍家岗区东站路189号,30.669835,宜昌,,S942039,1,84,11,,,H 湖北,1021
0716-8490969,,荆州市恒信一路汽车销售服务有限公司,112.227806,荆州市荆沙大道马河渔场,30.361951,荆州,,S942024,1,222,11,434000,,H 湖北,490
0712-2512777-102,,孝感国富汽车销售服务有限公司,113.990797,湖北省孝感市孝武大道178号,30.863598,孝感,,S942026,1,228,11,432020,,H 湖北,506
0719-8782828,,湖北十堰东富汽车销售服务有限公司,110.830331,湖北省十堰市茅箭区丹江路23号,32.590956,十堰,,S942027,1,230,11,442000,,H 湖北,525
0718-8268768 ,,恩施恒信众联汽车销售服务有限公司,109.502907,湖北省恩施市金桂大道耿家坪,30.328838,恩施,,S942025,1,241,11,445000,,H 湖北,581
0715-8828766,,咸宁恒信众联汽车销售服务有限公司,114.320813,咸宁市咸安区京珠联结线张双路旁（官埠镇小泉村）,29.892519,咸宁,,S942028,1,262,11,437000,,H 湖北,588
0724-6903555,,荆门恒信众联汽车销售服务有限公司,112.243462,荆门市月亮湖路76号,31.050555,荆门,,S942029,1,270,11,448000,,H 湖北,615
0713-8396999-8001,,黄冈恒信众联汽车销售服务有限公司,114.925847,黄冈市明珠大道86号,30.461816,黄冈,,S942030,1,273,11,438000,,H 湖北,628
0710-2552222,,襄阳恒信众联汽车销售服务有限公司,112.259775,襄阳市襄州区深圳工业园A39-6地块,32.12106,襄阳,,S942035,1,290,11,441104,,H 湖北,677
0722-3564555,,随州东富汽车销售服务有限公司,113.448291,随州市经济开发区交通大道望城岗7号 ,31.691966,随州,,S942037,1,346,11,,,H 湖北,916
0728-3500222,,潜江恒信众联汽车销售服务有限公司,112.907445,潜江市泰丰办事处紫月路中段园艺村一组 ,30.391706,潜江,,S242002,1,355,11,,,H 湖北,986
0711-3690666,,鄂州锦坤汽车销售服务有限公司,114.879732,鄂州市鄂黄连接线葛山段量兴汽车城,30.355739,鄂州,,S942038,1,364,11,,,H 湖北,1028
0736-7809888,,常德裕安贸易有限公司,111.682485,常德市207国道南坪段新世纪汽车城内,29.076518,常德,,S743010,1,72,10,415000,,H 湖南,180
0736-67266888,,常德澄冬汽车销售有限公司,111.723103,湖南省常德经济技术开发区德山镇五一居委会十一组（五一居委会斜对面）,28.952922,常德,,S243007,1,72,10,,,H 湖南,1061
18973678566,,常德裕安贸易有限公司汉寿分公司,111.96904,汉寿县龙阳镇麻园坝村,28.874042,常德,,S743010M1,2,72,10,,,H 湖南,1069
0731-82870988,,湖南汽车城永通有限公司,113.072473,长沙市星沙经济开发区中南汽车世界经贸西路H08区,28.240693,长沙,,S943001,1,73,10,410100,,H 湖南,177
0731-85048888,,湖南华洋汽车贸易有限公司,113.035815,长沙市雨花区黄谷路308号,28.087926,长沙,,S743009,1,73,10,410014,,H 湖南,179
0731-85226768,,湖南中拓瑞众汽车销售服务有限公司,112.996207,湖南省长沙市芙蓉南路二段123号,28.102038,长沙,,S743016,1,73,10,410000,,H 湖南,518
0731-88389000,,湖南永通汽车销售服务有限公司,112.89819,长沙市望城区大泽湖街道吴家冲路28号,28.320619,长沙,,S743021,1,73,10,410219,,H 湖南,782
0731-88441111,,湖南华洋众广汽车销售服务有限公司,112.865792,长沙市岳麓区高新开发区麓谷汽车城长四路,28.214288,长沙,,S743022,1,73,10,410205,,H 湖南,812
0731-83836888,,浏阳永通汽车销售服务有限公司,113.649718,浏阳关口工业小区（消防大队斜对面）,28.187748,长沙,,S743026,1,73,10,,,H 湖南,888
0731-85919888,,湖南长久博腾汽车销售服务有限公司,112.954975,湖南省长沙市岳麓区岳麓街道五星村99号 ,28.144755,长沙,,S743028,1,73,10,,,H 湖南,982
4000731118,,长沙大汉汽车贸易有限公司,113.090915,长沙市芙蓉区远大路与红旗路交汇处西南角,28.210719,长沙,,S743030,1,73,10,,,H 湖南,1000
0731-87362538,,湖南中拓瑞鑫汽车销售服务有限公司,112.54808,湖南省长沙市宁乡县白马桥乡仁福村（食品工业园）,28.235937,长沙,,S743027,1,73,10,,,H 湖南,1005
0739-5282528,,邵阳市宝庆汽车超市有限公司,111.524103,邵阳市宝庆东路169号,27.254520,邵阳,,S743013,1,74,10,422001,,H 湖南,208
18975908099,,邵阳市宝庆汽车超市有限公司邵东分公司,111.735076,邵东县开发区皮具工贸园皮具大道,27.27231,邵阳,,S743013M1,2,74,10,,,H 湖南,1067
0731-28454848,,株洲蓝马汽车销售服务有限公司,113.161331,株洲市国家汽车城品牌车专卖A区一汽-大众4S店,27.869704,株洲,,S743008,1,76,10,412000,,H 湖南,178
0731-22833777,,株洲市健车行汽车服务有限公司,113.140473,株洲市天元区黄河南路192号,27.816032,株洲,,S743024,1,76,10,412007,,H 湖南,813
0731-22063366,,攸县健车行汽车服务有限公司,113.403554,攸县湘东汽贸城一汽大众4s店,27.020953,株洲,,S243004,1,76,10,,,H 湖南,1046
0731-55188851,,湘潭市健车行汽车服务有限公司,112.527829,湘潭市岳塘区双马镇迅达科技圆东侧,27.752299,湘潭,,S843001,1,77,10,411100,,H 湖南,183
0731-55515888,,湘潭众富汽车销售服务有限公司,112.939921,湘潭市九华示范区湘望路九华汽车大世界8号,27.946793,湘潭,,S743034,1,77,10,411201,,H 湖南,706
0731-56977666,,湘乡湘健汽车服务有限公司,112.525708,湖南省湘乡市红仑大道汽车北站,27.751456,湘潭,,S243003,1,77,10,,,H 湖南,970
0734-8517777,,衡阳市西城汽车经贸有限公司,112.613877,湖南省衡阳市石鼓区107国道望城路口,26.941855,衡阳,,S743011,1,78,10,421005,,H 湖南,181
0734-8121111,,衡阳长久博华汽车销售服务有限公司,112.578764,衡阳市蒸湘区杨柳村二组,26.871878,衡阳,,S743029,1,78,10,,,H 湖南,1015
18692024681,,衡阳市西城汽车经贸有限公司耒阳汽车销售分公司,112.870306,耒阳市蔡子池街道办事处梅桥居委会十二组1栋,26.428561,衡阳,,S743011M1,2,78,10,,,H 湖南,1085
0730-8715498,,湖南邦田汽车服务有限公司,113.180505,湖南省岳阳市巴陵东路382号,29.376283,岳阳,,S743014,1,79,10,414000,,H 湖南,280
0730-6663189,,平江县邦田汽车服务有限公司,113.581361,湖南省平江县城关镇寺前工业小区,28.699651,岳阳,,S243002,1,79,10,,,H 湖南,894
0730-8572288,,岳阳大汉汽贸有限公司,113.180304,"""湖南省岳阳城陵矶临港产业新区联港路 """,29.425897,岳阳,,S743031,1,79,10,,,H 湖南,984
18773055550,,湖南邦田汽车服务有限公司湘阴分公司,112.902639,湘阴县文星镇长岭路与湘阴大道交汇处湘长大厦,28.682154,岳阳,,S743014M1,2,79,10,,,H 湖南,1066
0735-2267888,,郴州永通汽车销售服务有限公司,113.07346,湖南省郴州市苏仙区锁石路东侧,25.788413,郴州,,S743023,1,80,10,423000,,H 湖南,723
0735-3388333,,郴州华运通汽车销售服务有限公司,112.959825,郴州市北湖区保和镇雷大桥村万华汽车城一汽大众4S店,25.751697,郴州,,S743033,1,80,10,,,H 湖南,1051
0738-8813111/0738-8813222,,娄底大汉汽车贸易有限公司,112.018350,湖南省娄底市娄星区大科办事处大新居委会（汽车南站往南800米处）,27.687909,娄底,,S743018,1,225,10,417000,,H 湖南,531
0738-4241222,,涟源市大汉汽车贸易有限公司,111.695783,湖南省涟源市石马山镇张家湾娄新高速联络线收费站出口200米处,27.693878,娄底,,S243006,1,225,10,,,H 湖南,1057
13034831578,,娄底大汉汽车贸易有限公司双峰分公司,112.018187,双峰经济开发区科技工业园（和森路南侧）,27.688112,娄底,,S743018M2,2,225,10,,,H 湖南,1079
15581331777,,娄底大汉汽车贸易有限公司新化分公司,111.34875,新化县桑梓镇青峰村6组,27.743905,娄底,,S743018M1,2,225,10,,,H 湖南,1080
0746-8332377,,湖南省永州市永恒汽车贸易有限公司,111.611061,湖南省永州市长丰工业园长丰大道南侧101号,26.404774,永州,,S743015,1,227,10,425000,,H 湖南,512
0745-2836888,,怀化春茂汽车销售服务有限公司,109.960480,怀化市包茂高速公路出入口一汽大众4S店,27.491097,怀化,,S743019,1,275,10,418000,,H 湖南,633
0745-2333666,,怀化永通汽车销售服务有限公司,110.008552,湖南省怀化市鹤城区南环路（怀化国际汽车城内）,27.523702,怀化,,S743032,1,275,10,,,H 湖南,1036
0737-2234567,,益阳永通汽车销售服务有限公司,112.403038,益阳市高新区益宁城际干道（火车东站旁）,28.513829,益阳,,S743020,1,282,10,413000,,H 湖南,657
0744-8565222,,张家界永通汽车销售服务有限公司,110.564958,张家界市永定区阳湖坪镇经济开发区C区九城汽车大世界（高速收费站旁）,29.139133,张家界,,S243001,1,337,10,,,H 湖南,884
0743-8711777,,湘西永通汽车销售服务有限公司,109.704552,湖南省吉首市湘西经济开发区内（湘西民族职业技术学院对面）,28.268551,吉首,,S743025,1,338,10,,,H 湖南,889
0451-82041234,,哈尔滨一汽森华汽车贸易有限公司,126.762236,哈尔滨市道外区天恒大街5号,45.798329,哈尔滨,,S923002,1,65,9,150059,,H 黑龙江,29
0451-82050588,,黑龙江博远汽车维修有限公司,126.760495,哈尔滨市香坊区公滨路47号,45.731451,哈尔滨,,S723012,1,65,9,150038,,H 黑龙江,33
0451-82424999,,哈尔滨中汽汽贸汽车销售服务有限公司,126.738511,哈尔滨市道外区先锋路30号,45.778378,哈尔滨,,S723019,1,65,9,150056,,H 黑龙江,223
0451-84372888 ,,龙海汽车销售集团股份有限公司,126.583604,哈尔滨市道里区城乡路301号,45.730023,哈尔滨,,S723023,1,65,9,150070,,H 黑龙江,224
0451-82339222,,黑龙江运通俊业汽车销售服务有限公司,126.701871,哈尔滨市南岗区红旗大街222号,45.755831,哈尔滨,,S723009,1,65,9,150090,,H 黑龙江,385
0451-51862666,,哈尔滨诚杰汽车销售有限公司,126.610672,哈尔滨市平房区哈南工业新城松花路37号,45.616254,哈尔滨,,S723024,1,65,9,150060,,H 黑龙江,760
0451―87508056,,哈尔滨运通俊恩汽车销售服务有限公司,126.653419,哈尔滨市南岗区哈平路162号,45.685227,哈尔滨,,S723034,1,65,9,150081,,H 黑龙江,819
0451-53500088,,黑龙江龙海博众汽车销售服务有限公司,127.171164,五常镇亚臣路与文化路交汇处（杏花村）,44.907629,哈尔滨,,S223003,1,65,9,150070,,H 黑龙江,821
0467-2678023,,鸡西市英华进口汽车服务有限公司,131.026498,鸡西市鸡冠区兴国东路39号,45.299805,鸡西,,S723020,1,66,9,158100,,H 黑龙江,2
0454-8583335-1,,佳木斯安诚轿车销售服务有限公司,130.332704,佳木斯市红旗路166号,46.818872,佳木斯,,S723015,1,67,9,154004,,H 黑龙江,35
0454-2645888,,富锦安诚汽车销售服务有限公司,132.077879,黑龙江省富锦市锦绣大街东段与富宏路交叉口,47.253195,佳木斯,,S223001,1,67,9,156100,,H 黑龙江,825
0453-6888880-1,,牡丹江中信汽车销售服务有限责任公司,129.681627,牡丹江市裕民路169号,44.638930,牡丹江,,S723014,1,68,9,157000,,H 黑龙江,225
0452-6105077 ,,齐齐哈尔粤华轿车销售有限公司,123.939244,齐齐哈尔市高新技术产业开发区鹤城路1号,47.312683,齐齐哈尔,,S723021,1,69,9,161005,,H 黑龙江,37
0452-2527336/2527337,,齐齐哈尔华明晟通汽车销售有限公司,124.07279,齐齐哈尔市铁峰区联通大道汽贸城,47.348831,齐齐哈尔,,S723027,1,69,9,,,H 黑龙江,870
0459-6136100 ,,大庆世腾汽车销售有限公司,124.913027,大庆市让胡路区东环路西侧北方汽配城（一中灯岗往东湖方向550米）,46.609392,大庆,,S723016,1,70,9,163458,,H 黑龙江,492
0459-6590000/6591111,,大庆世腾骏兴汽车销售服务有限公司,125.162975,大庆市高新开发区汽车工业园庆新东街,46.569160,大庆,,S723022,1,70,9,163311,,H 黑龙江,609
0459-6303333,,大庆名派汽车销售服务有限公司,125.016551,大庆市萨尔图区世纪大道北侧、大庆长途客运站西侧 ,46.614414,大庆,,S723030,1,70,9,,,H 黑龙江,958
0455-7859000,,黑龙江龙众汽车销售服务有限公司,126.975967,黑龙江省绥化市北林区康庄路西电力名苑南,46.625064,绥化,,S723025,1,292,9,152000,,H 黑龙江,682
0451-3593399,,鹤岗骏达汽车销售有限公司,130.360469,鹤岗市东山区产业园A区,47.335546,鹤岗,,S723026,1,313,9,154100,,H 黑龙江,788
0464-9959333,,七台河市龙海汇众汽车销售服务有限公司,131.001387,七台河市桃山区308省道（桃山立井对面）,45.763291,七台河,,S723032,1,324,9,154600,,H 黑龙江,820
0469-4680468,,双鸭山安诚汽车销售服务有限公司,131.16801,黑龙江省双鸭市集贤县福利镇龙飞公汽运输有限公司3号楼1-1号,46.735407,双鸭山,,S723028,1,325,9,155900,,H 黑龙江,823
0458-3023111,,伊春龙海德众汽车销售有限公司,128.828487,黑龙江省伊春市乌马河区振华街（126-258）林都加油站东侧,47.711344,伊春,,S223002,1,327,9,,,H 黑龙江,832
0457-2736111,,大兴安岭龙海兴众汽车销售服务有限公司,124.090952,大兴安岭加格达奇区春晖变电站东侧,50.439658,大兴安岭地区,,S723029,1,335,9,,,H 黑龙江,871
0456-6865111,,北安市粤华汽车销售有限公司,126.463285,黑龙江省北安市汽车产业园区202国道西侧,48.239585,黑河,,S723031,1,361,9,,,H 黑龙江,1020
0431-87616222,,长春通立汽车商贸有限公司,125.281742,长春市绿园区普阳街3202号,43.878024,长春,,S722030,1,85,12,130011,,J 吉林,23
0431-84671199,,吉林省吉刚汽车贸易有限公司,125.394039,长春市自由大路6308号,43.870699,长春,,S722005,1,85,12,130033,,J 吉林,24
0431-84664688,,长春市华阳汽车贸易有限责任公司,125.378999,长春市东南湖大路1033,43.858121,长春,,S722017,1,85,12,130033,,J 吉林,25
0431-88785111,,长春通立德众汽车服务有限公司,125.435357,长春市净月高新技术产业开发区净月大街2266号,43.836949,长春,,S722044,1,85,12,130000,,J 吉林,65
0431-87988588,,长春汇腾汽车销售服务有限公司,125.250827,长春市汽车产业开发区景阳大路3688号,43.889340,长春,,S722032,1,85,12,130062,,J 吉林,219
0431-85516611,,吉林省华之诚汽车销售服务有限公司,125.240345,吉林省长春市长沈路488号,43.848195,长春,,S722028,1,85,12,130011,,J 吉林,220
0431-87022998,,长春瑞骐汽车销售服务有限公司,125.253842,长春市高新技术开发区蔚山路3823号,43.821960,长春,,S722035,1,85,12,130031,,J 吉林,478
0431-82608222,,长春郁晟汽车销售有限公司,125.221866,长春高新区卓越大街666号,43.781395,长春,,S722064,1,85,12,130103,,J 吉林,599
0431-85908163,,长春一汽实业众捷汽车销售有限公司,125.271041,东风大街669号,43.872619,长春,,S722039,1,85,12,130011,,J 吉林,621
0431-85524666,,吉林省久恒汽车销售服务有限公司,125.224083,长沈路1866号,43.841623,长春,,S722057,1,85,12,130011,,J 吉林,622
0431-88787333,,吉林省华之诚世达汽车销售服务有限公司,125.300122,吉林省长春市宽城区青年路3875号,43.941131,长春,,S722041,1,85,12,130052,,J 吉林,713
0431-85029555,,吉林省驰恒汽车销售服务有限公司,125.336106,长春市宽城区九台北路1633号,43.949390,长春,,S722037,1,85,12,130051,,J 吉林,718
18100499555,,吉林省吉刚汽车贸易有限公司农安分公司,125.192571,吉林省长春市农安县工业集中区吉刚汽贸城1号楼22号,44.467996,长春,,S722005M1,2,85,12,,,J 吉林,1113
0438-6336666,,吉林石油装备汽车销售维修服务有限公司,124.818942,吉林省松原市长宁北街499号,45.198670,松原,,S722027,1,86,12,138000,,J 吉林,28
0438-2088866,,松原汇众汽车销售服务有限公司,124.793534,松原经济技术开发区创业大街2号,45.13763,松原,,S722040,1,86,12,138000,,J 吉林,711
0432-64673333,,吉林市神华大众汽车服务有限责任公司,126.575697,吉林市丰满经济开发区吉桦路188号,43.778159,吉林,,S722002,1,87,12,132013,,J 吉林,221
0432-62269998,,吉林市神洲大众汽车销售服务有限公司,126.527038,吉林省吉林市船营区越山路408-3号,43.871834,吉林,,S722033,1,87,12,132011,,J 吉林,562
0435-3620866,,通化鑫宇汽车销售有限公司,125.955872,新胜北路2355号,41.766311,通化,,S722023,1,88,12,134000,,J 吉林,222
18343552999,,通化鑫宇汽车销售有限公司梅河口市分公司,125.750707,梅河口市北环东路与建国路交汇处,42.288422,通化,,S722023M1,2,88,12,,,J 吉林,1078
0433-2837449,,延吉中诚汽车贸易有限公司,129.544273,延吉市开发区长白路256号,42.900506,延吉,,S722021,1,89,12,133000,,J 吉林,26
0439-3357668,,白山市众合汽车销售维修有限公司,126.439496,吉林省白山市八道江区江北物流中心西侧,41.965077,白山,,S722026,1,90,12,134300,,J 吉林,27
0434-6997788/0434-6997799,,四平汇众汽车销售服务有限公司,124.374188,四平市红嘴开发区兴红路2号,43.200161,四平,,S722036,1,229,12,136000,,J 吉林,520
0434-7316666,,双辽汇众汽车销售服务有限公司,123.461454,吉林省双辽市辽西街吉兴委5组 ,43.519516,四平,,S222002,1,229,12,,,J 吉林,919
0434-5162999,,公主岭汇众汽车销售服务有限公司,124.875305,公主岭岭东工业集中区，新102国道998公里处,43.518166,四平,,S222001,1,229,12,,,J 吉林,1030
13039021155,,四平汇众汽车销售服务有限公司伊通分公司,125.298383,伊通满族自治县伊通镇七星街（二小学北侧）,43.35347,四平,,S722036M1,2,229,12,,,J 吉林,1103
0431-83939825,,吉林省驰久汽车销售服务有限公司,126.546666,吉林省榆树市榆三公路五公里700米处（廉家道口）,44.848704,榆树,,S222003,1,343,12,,,J 吉林,905
0436-3526666,,白城汇众汽车销售服务有限公司,122.839458,白城市洮白公路1008号 ,45.582405,白城,,S722058,1,349,12,,,J 吉林,933
0437-3725111,,辽源市聚鑫汽车销售服务有限公司,125.202665,吉林省辽源市龙山区工农乡苇塘村二组（新车管所隔壁）,42.871345,辽源,,S722059,1,357,12,,,J 吉林,1003
0519-86522888       ,,常州宝达汽车销售服务有限公司,119.965626,常州市武进汽车城A区5号,31.700436,常州,,S732038,1,91,13,213161,,J 江苏,95
0519-85102028,,常州国际汽车城有限公司,119.987493,常州市新北区黄河路98号,31.842504,常州,,S732029,1,91,13,213000,,J 江苏,101
0519-83971888,,常州市上瑞汽车销售服务有限公司,119.891447,常州钟楼经济开发区汽车服务中心A-3号,31.794973,常州,,S732052,1,91,13,213023,,J 江苏,563
0519-87616888,,溧阳宝达汽车销售服务有限公司,119.500439,江苏省溧阳市昆仑转盘西侧（溧阳汽车城）,31.469502,常州,,S732067,1,91,13,213300,,J 江苏,689
0519-82110888,,金坛宝达汽车销售服务有限公司,119.627458,金坛南环二路汽车城6号,31.736468,常州,,S732093,1,91,13,,,J 江苏,872
0519-88066618,,常州外汽东进汽车销售服务有限公司,120.102134,江苏省常州市武进区横山桥镇省庄村横山桥汽车城 ,31.783593,常州,,S732072,1,91,13,,,J 江苏,922
0512-58185000,,张家港市汇众汽车销售有限公司,120.580974,张家港市鹿杨路1号（世纪星汽车城西侧）,31.881112,苏州,,S732041,1,93,13,215600,,J 江苏,94
0512-50338689,,昆山锦隆汽车贸易有限公司,120.979616,江苏省昆山市长江北路588号,31.444868,苏州,,S732019,1,93,13,215314,,J 江苏,96
0512-65766661,,苏州欧亚伟业实业有限公司,120.648318,苏州市相城区华元路99号,31.381349,苏州,,S732023,1,93,13,215131,,J 江苏,98
0512-68157000,,苏州汇凯汽车贸易有限公司,120.611429,苏州南环西路220号,31.283117,苏州,,S732036,1,93,13,215000,,J 江苏,211
