id,name,telphone,address,city-region,city,province-region,province,place
844,无锡东方乐通汽车销售服务有限公司,0510-82120000,无锡市金城东路290号新东方汽车城B10座,320200,无锡市,320000,江苏省,"31.567865,120.410316"
927,宜兴市苏源起亚汽车销售服务有限公司,0510-87077666,宜兴市融达汽车城（104国道旁）,320200,无锡市,320000,江苏省,"31.391815,119.790029"
930,江阴新东亚汽车销售服务有限公司,0510-80622666,江苏省江阴市澄杨路9号(锡澄高速南出口处),320200,无锡市,320000,江苏省,"31.89111,120.323008"
928,徐州润东汇景汽车销售服务有限公司,0516-87778181,江苏省徐州市金山桥开发区三环东路西侧,320300,徐州市,320000,江苏省,"34.291512,117.2476"
680,常州圣大汽车有限公司,0519-82715888/ 0519-82759999,金坛市汽车城9号,320400,常州市,320000,江苏省,"31.735981,119.629653"
843,常州万事达汽车有限公司,0519-85215018,常州市新北区外环路3号,320400,常州市,320000,江苏省,"31.815971,119.96735"
1030,溧阳顺达起亚汽车销售服务有限公司,0519-87875500,溧阳市昆仑南路29号,320400,常州市,320000,江苏省,"31.429178,119.506518"
636,苏州诚国汽车销售服务有限公司,0512-66029111,苏州市吴中区f直镇鸣市路16号,320500,苏州市,320000,江苏省,"31.287213,120.831732"
753,苏州圣雄汽车销售服务有限公司,0512-65966888,苏州市吴中区吴中经济开发区尹中南路3号,320500,苏州市,320000,江苏省,"31.236268,120.672768"
912,昆山新达汽车销售服务有限公司,0512-57061188,昆山市长江北路566号,320500,苏州市,320000,江苏省,"31.443542,120.980066"
931,张家港市凯达汽车销售服务有限公司,0512-58983666,张家港市鹿杨路1号,320500,苏州市,320000,江苏省,"31.844034,120.576998"
965,常熟市东盛汽车销售服务有限公司,0512-52830099,江苏省常熟市青墩塘路218号(汽车市场品牌区),320500,苏州市,320000,江苏省,"31.6419609,120.802343"
970,苏州丰丰汽车销售服务有限公司,0512-66901600,苏州市新区国际汽车城塔园路浩福路8号,320500,苏州市,320000,江苏省,"31.326163,120.564747"
1027,吴江市伟伟汽车销售服务有限公司,0512-63691222,吴江市平望镇梅堰社区318国道旁,320500,苏州市,320000,江苏省,"30.983272,120.584546"
1187,昆山市海悦汽车销售服务有限公司,0512-57123456,昆山中环萧林东路出口向东500米（周市汽车城内）,320500,苏州市,320000,江苏省,"31.409949,121.024486"
736,如东起成汽车销售服务有限公司,0513-84539555,如东县掘港镇南环路8号（国清寺向西380米、如东汽车城）,320600,南通市,320000,江苏省,"32.298642,121.163756"
845,南通嘉华汽车销售服务有限公司,0513-85605888,南通市城港路150号,320600,南通市,320000,江苏省,"32.040984,120.811988"
975,海门宝力汽车销售服务有限公司,0513-82336818,海门市人民西路1688号,320600,南通市,320000,江苏省,"31.89178,121.131869"
1047,南通益佳汽车销售服务有限公司,0513-87291666,如皋市如城镇惠政路888号,320600,南通市,320000,江苏省,"32.363697,120.557674"
1086,海安车行天下汽车销售有限公司,0513-80688888,海安县城东镇立发桥村20组,320600,南通市,320000,江苏省,"32.541239,120.514885"
1155,连云港悦亚汽车销售有限公司,0518-85913366,连云港经济技术开发区东方大道15号,320700,连云港市,320000,江苏省,"34.719841,119.31301"
926,淮安市新兴汽车销售维修有限公司,0517-83340018,淮安市厦门西路26号,320800,淮安市,320000,江苏省,"33.589431,119.07587"
627,江苏达维起亚汽车销售服务有限公司,0515-87188718,江苏盐城阜宁县施庄和平居委会（中国馆对面）,320900,盐城市,320000,江苏省,"33.752085,119.841378"
728,滨海悦亚汽车销售有限公司,0515-89105555,江苏省盐城市滨海县东明广场A2栋,320900,盐城市,320000,江苏省,"34.053123,119.89941"
729,江苏亚尊实业有限公司,0515-82398888,盐城市射阳县经济开发区农机五金城西侧,320900,盐城市,320000,江苏省,"33.76323,120.23205"
846,江苏悦达嘉华汽车销售服务有限公司,0515-88334599,盐城市开放大道8号,320900,盐城市,320000,江苏省,"33.371745,120.172294"
934,江苏捷翔汽车销售服务有限公司,0515-88413300,盐城市盐都区东方汽贸广场开创路2-2号,320900,盐城市,320000,江苏省,"33.335153,120.138631"
1084,江苏悦达东方汽车销售服务有限公司,0515-89850000,盐城市经济开发区希望大道99号,320900,盐城市,320000,江苏省,"33.374834,120.225304"
1136,江苏新中兴汽车销售有限公司,0515-68858488,江苏省大丰市疏港路金丰北路口,320900,盐城市,320000,江苏省,"33.225115,120.464132"
1139,江苏悦亚汽车销售服务有限公司,0515-85217888,江苏东台市城东新区永宁汽车城,320900,盐城市,320000,江苏省,"32.864726,120.424851"
1212,响水嘉成汽车销售有限公司,0515-86865938,响水县经济开发区204国道东侧、题桥北侧（昌宇汽车城）,320900,盐城市,320000,江苏省,"34.181184,119.611449"
1092,扬州市龙兴汽车销售有限公司,0514-80916888,江都市华山路606城北工业园(仙女庙中队向东200米）,321000,扬州市,320000,江苏省,"32.4577433,119.556016"
679,扬中市永达汽车销售服务有限公司,0511-88227222,扬中市新238省道新坝镇,321100,镇江市,320000,江苏省,"32.250788,119.801185"
735,句容鼎悦汽车销售服务有限公司,0511-87311222,江苏省句容市宁杭南路86号爵鼎汽车产业园,321100,镇江市,320000,江苏省,"31.933221,119.175062"
919,镇江凡达汽车销售有限公司,0511-88892378,镇江市丁卯开发区丁长路经十二路以东303号,321100,镇江市,320000,江苏省,"32.184902,119.521533"
808,泰兴市星亚汽车销售服务有限公司,0523-89771111,泰兴市东三环汽车城内,321200,泰州市,320000,江苏省,"32.205028,120.054527"
823,靖江市新悦汽车销售服务有限公司,0523-84585899,江苏省靖江市江平西路588号恒力汽车园内,321200,泰州市,320000,江苏省,"32.037759,120.243451"
1074,泰州海洋汽车销售服务有限公司,0523-86661818,泰州市寺巷经济开发区国际汽车城内,321200,泰州市,320000,江苏省,"32.424256,119.908441"
651,泗洪苏驰恒基汽车销售服务有限公司,0527-86566777,江苏省宿迁市泗洪国际汽车城东风悦达起亚4S店,321300,宿迁市,320000,江苏省,"33.443702,118.188143"
953,宿迁市良宇起亚汽车销售服务有限公司,0527-84568600,江苏宿迁市西湖路600号,321300,宿迁市,320000,江苏省,"33.94371,118.256262"
1138,沭阳县恒广汽车销售服务有限公司,0527-83691111,沭阳县永康南路与武进路路口,321300,宿迁市,320000,江苏省,"34.093958,118.805575"
842,浙江东风南方起亚汽车销售服务有限公司,0571-88292000,杭州市拱墅区石祥路463-2号,330100,杭州市,330000,浙江省,"30.337194,120.134825"
1008,杭州德龙汽车销售服务有限公司,0571-83866000,萧山市心北路与机场高速路交叉口（2号地铁线振宁路A出口）,330100,杭州市,330000,浙江省,"30.227086,120.276128"
1035,杭州正工鸿大汽车销售服务有限公司,0571-89175555,杭州市余杭区临平街道临平大道666号,330100,杭州市,330000,浙江省,"30.44271,120.283327"
1088,杭州昌炎汽车销售服务有限公司,0571-64718068,浙江省建德市新安江街道黄泥墩村（车管所旁）,330100,杭州市,330000,浙江省,"29.449113,119.277549"
1096,杭州圣大汽车有限公司,0571-86637666,浙江省杭州市江干区杭海路728-744号,330100,杭州市,330000,浙江省,"30.3029,120.267937"
1156,杭州富阳大地汽车销售有限公司,0571-23270777,富阳市新桥新路9号,330100,杭州市,330000,浙江省,"30.093349,119.944071"
613,宁波腾峰锦华汽车销售服务有限公司,57487076000,宁波市镇海区庄市街道胜隆村兆龙路北,330200,宁波市,330000,浙江省,"29.935804,121.609451"
634,宁波大港启航汽车销售服务有限公司,0574-56580000,浙江省宁波市北仑区明州西路555号,330200,宁波市,330000,浙江省,"29.932237,121.820558"
682,象山峰华汽车有限公司,0574-55866888,浙江省象山县城南高新创业园（汽车城）,330200,宁波市,330000,浙江省,"29.422698,121.898824"
839,宁波天天汽车贸易有限公司,0574-87466567,宁波市海曙区顺德路78弄78号,330200,宁波市,330000,浙江省,"29.853444,121.529071"
946,慈溪市广顺汽车销售服务有限公司,0574-63515288,浙江省慈溪市逍林镇新园村汽车城（匡堰大道往北1.5公里）,330200,宁波市,330000,浙江省,"30.180365,121.313955"
1077,余姚市东悦汽车销售服务有限公司,0574-22716999,浙江省宁波余姚市风山街道同光村,330200,宁波市,330000,浙江省,"30.0499846,121.224068"
616,乐清市红通汽车销售服务有限公司,0557-62061111,浙江省乐清市宁康东路557号,330300,温州市,330000,浙江省,"28.130356,120.99803"
909,浙江冠隆实业有限公司,0577-65320000,瑞安市塘下镇凤川路88号（104国道边）,330300,温州市,330000,浙江省,"27.847939,120.676805"
1068,苍南冠亚汽车销售服务有限公司,0577-68815555,温州苍南县建兴东路工业园区（浙闽物流中心对面）,330300,温州市,330000,浙江省,"27.537635,120.443002"
1093,温州冠特汽车销售服务有限公司,0577-56956111,温州瓯海大道428号（温州华特别克旁）,330300,温州市,330000,浙江省,"27.966637,120.667926"
1190,温州佳鑫汽车销售有限公司,0577-86660333,温州市温州大道829号,330300,温州市,330000,浙江省,"27.983104,120.739281"
741,嘉善亚升汽车销售服务有限公司,0573-89117666,浙江省嘉兴市嘉善县魏塘镇外环东路1058号,330400,嘉兴市,330000,浙江省,"30.87152,120.941528"
822,平湖市华隆汽车销售服务有限公司,0573-85119000,平湖市当湖街道长胜路1280号,330400,嘉兴市,330000,浙江省,"30.68247,121.052455"
1023,浙江华隆汽车销售服务有限公司,0573-80882222,浙江省桐乡市环城东路与振华东路振东开发区,330400,嘉兴市,330000,浙江省,"30.624644,120.586891"
1186,浙江正工鸿图汽车销售服务有限公司,0573-89701111,海宁市海宁经济开发区文苑路481号,330400,嘉兴市,330000,浙江省,"30.548244,120.686694"
625,安吉起建汽车销售服务有限公司,0572-5055323,浙江安吉浮玉中路418号,330500,湖州市,330000,浙江省,"30.636935,119.667571"
743,长兴东进汽车销售服务有限公司,0572-6586000,浙江省湖州市长兴县李家巷镇工业集中区,330500,湖州市,330000,浙江省,"30.980209,119.957473"
684,绍兴上虞锦程汽车销售服务有限公司,0575-81285555,江省绍兴市上虞区曹娥街道五星中路666号（光明村口）,330600,绍兴市,330000,浙江省,"30.032752,120.836886"
740,嵊州市联通汽车销售服务有限公司,0575-83111188,嵊州市经济开发区莲塘村--联通汽车旁,330600,绍兴市,330000,浙江省,"29.585657,120.85801"
972,绍兴菲越汽车销售服务有限公司,0575-88370011,绍兴市袍江康宁路车管所斜对面（起亚4S店）,330600,绍兴市,330000,浙江省,"30.098827,120.620083"
1159,绍兴悦泰汽车销售服务有限公司,0575-85671666,绍兴县金柯桥大道国际村对面（高速出口2公里）,330600,绍兴市,330000,浙江省,"30.125694,120.523566"
618,浦江众享汽车销售服务有限公司,0579-88191688,浦江县平七路7号（浦江中学北面）,330700,金华市,330000,浙江省,"29.447794,119.935144"
683,兰溪玮龙汽车销售服务有限公司,0579-88937777,浙江省兰溪市横山路1000号,330700,金华市,330000,浙江省,"29.229196,119.454463"
742,东阳悦辰汽车销售服务有限公司,0579-86783666,东阳市白云街道佳轮路1号,330700,金华市,330000,浙江省,"29.277909,120.21293"
840,义乌市鑫元汽车销售服务有限公司,0579-85681258,义乌市后宅汽车城,330700,金华市,330000,浙江省,"29.368498,120.056197"
924,浙江日通汽车销售有限公司,0579-89177652,金华市汽车城西九路14-2号,330700,金华市,330000,浙江省,"29.147958,119.693388"
620,江山顺龙汽车销售服务有限公司,0570-4571666,浙江省江山市双塔街道塔东村百廿秤自然村113号,330800,衢州市,330000,浙江省,"28.770883,118.682122"
951,衢州悦亚汽车销售服务有限公司,0570-8286666,衢州市浙西大道103号,330800,衢州市,330000,浙江省,"28.938757,118.903271"
619,舟山市众通汽车销售服务有限公司,0580-8217778,浙江省舟山市定海区双桥汽车城2期2号,330900,舟山市,330000,浙江省,"30.023545,122.035684"
802,台州市黄岩金泰汽车销售服务有限公司,0576-84517777,台州市黄岩北城街道五里牌村,331000,台州市,330000,浙江省,"28.670373,121.255407"
841,台州市得意达汽车销售服务有限公司,0576-82693888,台州市路桥区峰江十份(104国道旁),331000,台州市,330000,浙江省,"28.552664,121.394456"
1061,台州台运韩亚汽车销售服务有限公司,0576-85127711,浙江省临海市江南大道595号,331000,台州市,330000,浙江省,"28.821293,121.149588"
847,安徽省先驱汽车有限公司,0551-64288888,合肥市双七路18号(安徽国际汽车城),340100,合肥市,340000,安徽省,"31.890589,117.342417"
1109,安徽安天迪凯汽车销售服务有限公司,0551-5118080,安徽省合肥市包河区长春街与长白山路交口,340100,合肥市,340000,安徽省,"31.805096,117.349697"
1188,安徽悦莱汽车销售服务有限公司,0551-68568166,合肥市长江西路名车广场 新华夏大厦1288-1号,340100,合肥市,340000,安徽省,"31.860384,117.119068"
816,芜湖市顺易汽车贸易有限公司,0553－3867171,芜湖市鲁港高新技术产业开发区长江南路86号,340200,芜湖市,340000,安徽省,"31.275616,118.357715"
652,蚌埠福顺汽车贸易有限公司,0552-3750222,蚌埠市迎宾大道国际汽车城北金和路15号,340300,蚌埠市,340000,安徽省,"32.872963,117.316889"
833,蚌埠润悦通亚汽车销售服务有限公司,0552-8829111,蚌埠市怀远工业园（蚌埠西高速路口向东50米）,340300,蚌埠市,340000,安徽省,"32.976329,117.264722"
1051,淮南市金悦汽车销售服务有限公司,0554-3311999,安徽省淮南市经济技术开发区国庆东路南侧,340400,淮南市,340000,安徽省,"32.662494,117.065062"
1069,马鞍山同利汽车销售有限公司,0555-6785555,安徽省马鞍山市当涂县经济开发区,340500,马鞍山市,340000,安徽省,"31.599895,118.495938"
1206,马鞍山同含汽车销售有限公司,0555-2147777,安徽省马鞍山市含山国本皖江大市场内,340500,马鞍山市,340000,安徽省,"31.13413,118.60847"
1137,淮北方力汽车销售服务有限公司,0561-3062666,淮北市汽车城骏驰路南仁和小区西,340600,淮北市,340000,安徽省,"33.932259,116.800633"
1015,铜陵万悦汽车销售服务有限公司,0562-2829288,安徽省铜陵市国际汽车城,340700,铜陵市,340000,安徽省,"30.943113,117.905056"
943,安庆市鑫马汽贸有限公司,0556-5836666,安庆市开发区中兴大道,340800,安庆市,340000,安徽省,"30.558338,117.063037"
1037,黄山市华帅汽车销售服务有限公司,0559-2599888,安徽省黄山市屯溪经济开发区梅林大道,341000,黄山市,340000,安徽省,"29.774608,118.271305"
1057,安徽省汇润汽车贸易有限公司,0550-6818888,滁州市花园东路698号,341100,滁州市,340000,安徽省,"32.274422,118.351816"
1238,滁州裕田汽车贸易服务有限公司,0550-2590888,滁州市丰乐大道2585号,341100,滁州市,340000,安徽省,"32.2530730000,118.3152720000"
799,阜阳市雪峰起亚汽车销售服务有限公司,0558-3805555,阜阳经济技术开发区纬五路北侧,341200,阜阳市,340000,安徽省,"32.846359,115.865091"
913,阜阳市迎驾悦达汽车销售服务有限公司,0558-2221111,安徽省阜阳市经济技术开发区新安大道169号,341200,阜阳市,340000,安徽省,"32.869344,115.852097"
615,宿州市亿之豪汽车销售服务有限公司,0557-2600119,宿州市东十里汽车城内（仁和路与凤鸣路交叉口南50米路东）,341300,宿州市,340000,安徽省,"33.64313,117.053044"
1085,宿州润捷汽车销售服务有限公司,0557-3728000,宿州市经济技术开发区金海大道东侧,341300,宿州市,340000,安徽省,"33.607171,117.007527"
954,巢湖龙天洋汽车销售服务/ 有限公司,0551-82358777,安徽省巢湖市经济开发区金山路,341400,巢湖市,340000,安徽省,"31.648305,117.913631"
1025,六安市悦亚汽车销售服务有限公司,0564-5226111,安徽省六安市霍山县迎驾大道(霍山驾校向西500米）,341500,六安市,340000,安徽省,"31.762871,116.574999"
1236,六安市东悦汽车销售服务有限公司,0564-3832999,安徽省金安经济开发区312国道与胜利南路交叉口,341500,六安市,340000,安徽省,"31.7682420000,116.6213580000"
778,蒙城县春雨慧悦汽车销售服务有限公司,0558-7695906,蒙城县经济开发区政通路,341600,亳州市,340000,安徽省,"33.24127,116.602199"
836,亳州市远景起亚汽车销售服务有限责任公司,0558-5776688,安徽省亳州市谯城区工业园区古井路1号,341600,亳州市,340000,安徽省,"33.83704,115.767555"
650,池州市中达汽车销售服务有限公司,0566-3381888,池州市站前区,341700,池州市,340000,安徽省,"40.684851,122.26626"
800,广德亚夏起悦汽车销售服务有限公司,0563-6059898,安徽省宣城市广德县桃州镇广溧路以西北环路以南,341800,宣城市,340000,安徽省,"30.917633,119.424716"
957,宣城亚悦汽车销售服务有限公司,0563-2626808,安徽省宣城市经济技术开发区（昭亭南路）宣城亚悦店,341800,宣城市,340000,安徽省,"30.937788,118.747955"
628,福州华骏凯宏汽车销售服务有限公司,0591-88616222,马尾区快安兴业东路160号,350100,福州市,350000,福建省,"26.027718,119.43396"
862,福州金洋汽车贸易有限公司,0591-87955533,福州市晋安区秀峰路216号,350100,福州市,350000,福建省,"26.139961,119.327349"
681,厦门华骏凯宏汽车销售服务有限公司,0592-6882266,厦门市海沧区坪埕东路39号,350200,厦门市,350000,福建省,"24.49753,118.006159"
1120,厦门国戎运兴汽车销售服务有限公司,0592-2527666,厦门市明区禾祥东路138号,350200,厦门市,350000,福建省,"24.477651,118.120718"
1017,莆田市万宝万泰汽车服务有限公司,0594-2777666,莆田市荔城区西天尾镇城涵西大道899号,350300,莆田市,350000,福建省,"25.47226,119.047923"
1006,三明金洋汽车贸易有限公司,0598-5757999,三明沙县洋坊汽车城 东风悦达起亚4S店,350400,三明市,350000,福建省,"26.389793,117.8246"
863,泉州汇京广安汽车销售有限公司,0595-86731666,泉州清骺发区吉泰路一号街坊(奥林匹克正对面800米),350500,泉州市,350000,福建省,"24.87572,118.549449"
973,福建省亿海汽车贸易有限公司,0595-88168181,晋江五里工业区社马路段（季延中学往马坪方向2公里）,350500,泉州市,350000,福建省,"24.7490983,118.566262"
781,漳州市中骏汽车贸易有限公司,0596-7031111,福建省漳州市芗城区金峰经济开发区闽南汽车贸易城9（漳州西高速出口）,350600,漳州市,350000,福建省,"24.587594,117.616097"
959,漳州市南龙汽车贸易有限公司,0596-2134888,漳州市龙文区迎宾大道云洞岩路口西侧200米处,350600,漳州市,350000,福建省,"24.497482,117.749886"
723,南平市永博汽车有限责任公司,5996-180666,南平市西芹镇水溪口城市交通枢纽中心,350700,南平市,350000,福建省,"27.334387,117.510807"
925,龙岩市奇迈汽车贸易有限公司,0597-2369199,龙岩市新罗区东城东宫下东兴路218号,350800,龙岩市,350000,福建省,"25.131107,117.057971"
1089,龙岩市万事达汽车贸易有限公司,0597－2503333,龙岩市新罗区龙门镇物流大道326-1号,350800,龙岩市,350000,福建省,"25.106374,116.961561"
632,福建省宁德市福宁时代汽车销售有限公司,0593-2765555,福建省宁德市蕉城区国道路31号,350900,宁德市,350000,福建省,"26.695197,119.529142"
870,江西东亚汽车销售服务有限公司,0791-83721978,南昌市红谷滩汽车广场C座2号,360100,南昌市,360000,江西省,"28.679475,115.842669"
1114,江西国力弘达汽车销售服务有限公司,0791-88629123,江西省南昌市青云谱区广州路155号,360100,南昌市,360000,江西省,"28.626897,115.930611"
1178,景德镇市辉煌汽车销售有限公司,0798-2086666,江西省景德镇市迎宾大道市体育中心斜对面,360200,景德镇市,360000,江西省,"29.314384,117.171812"
1148,萍乡市鑫亚汽车销售服务有限公司,0799-6658886,萍乡市安源区韶山东路,360300,萍乡市,360000,江西省,"27.625544,113.888524"
717,九江明大汽车销售服务有限公司,0792-8555022,江西省九江市前进西路399号,360400,九江市,360000,江西省,"29.682409,115.982502"
1140,新余东亚汽车销售服务有限公司,0790-6666659,新余市仙女湖中心物流园汽车城,360500,新余市,360000,江西省,"27.802686,114.875471"
1184,鹰潭鑫亚汽车销售服务有限公司,0701-6666666,江西省鹰潭市天洁西路28号,360600,鹰潭市,360000,江西省,"28.233563,117.008725"
644,赣州市环亚汽车销售服务有限公司,0797-6527796,赣州市南康区龙岭镇赣南汽车城B-10地块32号,360700,赣州市,360000,江西省,"25.737793,114.831635"
774,赣州钜德汽车销售服务有限公司,0797-4666999,江西省赣州市客家大道185号,360700,赣州市,360000,江西省,"25.890906,115.043321"
595,吉安优悦汽车销售服务有限公司,0796-8410666,江西省吉安市吉安县合丰汽车城105国道旁北1号,360800,吉安市,360000,江西省,"27.11351,115.022319"
685,江西省东鑫汽车销售服务有限公司,0795-5215333,江西省高安市320国道以北（江西高安货运汽车产业基地）,360900,宜春市,360000,江西省,"28.425152,115.353546"
1115,宜春市吉顺汽车销售服务有限公司,0795-3538888,江西省宜春市宜商大道1号（广汇国际汽车城）,360900,宜春市,360000,江西省,"27.84918,114.411268"
1130,抚州东之杰汽车销售服务有限公司,0794-8253331,江西省抚州市迎宾大道东侧南昌大学对面,361000,抚州市,360000,江西省,"27.964317,116.394778"
955,上饶市成通汽车销售有限公司,0793-6090555,上饶经济开发区311高速公路西互通西侧,361100,上饶市,360000,江西省,"28.463477,117.904736"
1224,上饶市广丰区成通汽车销售有限公司,0354-6333300,山西省晋中市太谷县108国道韩村段港田加油站东侧,361100,上饶市,360000,江西省,"28.463665,117.904641"
630,山东华德汇新汽车销售服务有限公司,0531-66677000,济南市市中区望岳路3777号鸿发汽车城南区（英雄山路延长线领秀城南行4公里路西）,370100,济南市,370000,山东省,"36.570928,116.996103"
853,济南金万通汽车贸易有限责任公司,0531-87566868/87566878,济南市经十西路88号,370100,济南市,370000,山东省,"36.646629,116.85508"
854,济南泰通汽车销售服务有限公司,0531-88929797,济南市历城区七里河路37号,370100,济南市,370000,山东省,"36.680918,117.086552"
932,山东银达汽车销售服务有限公司,0531-86397888,济南市槐荫区张庄路38号,370100,济南市,370000,山东省,"36.67328,116.964392"
933,山东安华汽车销售服务有限公司,0531-82372298,山东省济南市历下区工业南路69号,370100,济南市,370000,山东省,"36.6850806,117.113281"
1179,章丘金万通汽车销售服务有限公司,0531-61301111,山东省章丘市世纪西路志成工业园（西外环龙盘家具北500米）,370100,济南市,370000,山东省,"36.690475,117.519428"
631,青岛悦翔汽车销售服务有限公司,0532-88421777,山东青岛莱西市上海西路16号,370200,青岛市,370000,山东省,","
814,青岛汇丰汽车销售服务有限公司,0532-81123318,青岛胶州市兰州东路699号,370200,青岛市,370000,山东省,"36.298101,120.079572"
848,青岛新濠汽车贸易有限公司,0532-58808902,山东省青岛市市北区重庆南路176号,370200,青岛市,370000,山东省,"36.1272342,120.39189"
849,青岛润亚汽车销售服务有限公司,0532-87721767/1766,青岛市城阳区流亭街道308国道东,370200,青岛市,370000,山东省,"36.264211,120.428174"
1016,青岛瑞亚汽车销售服务有限公司,0532-88155555,山东省青岛市黄岛区东岳中路357号,370200,青岛市,370000,山东省,"35.895619,119.990343"
1056,青岛韩亚汽车销售服务有限公司,0532-86660888555/666,山东省青岛市四方区重庆南路157号,370200,青岛市,370000,山东省,"36.129003,120.395316"
1144,青岛钰滨赫汽车销售服务有限公司,0532―82560666,即墨市经济开发区青威路1050号,370200,青岛市,370000,山东省,"36.424003,120.493812"
1147,青岛悦祺汽车销售有限公司,0532-85360999,青岛市平度市青岛路477-7号（西关汽车城）青岛路4777号青岛千霖西关汽车城,370200,青岛市,370000,山东省,"36.781263,119.936936"
817,淄博悦骋汽车贸易有限公司,0533-7171888,山东省淄博市临淄区临淄大道与清田路路口交汇处向西500米路南,370300,淄博市,370000,山东省,"36.824971,118.225444"
851,淄博东煜达汽车有限公司,0533-2983700,淄博市张店区山泉路212号,370300,淄博市,370000,山东省,"36.771178,118.045871"
937,淄博顺骋汽车贸易有限公司,0533-6219000,山东省淄博市张店区中心路176-1号,370300,淄博市,370000,山东省,"36.832371,118.075076"
689,滕州东亚汽车销售服务有限公司,0632-5085555,滕州市龙泉南路王开转盘南600米路东,370400,枣庄市,370000,山东省,"35.050808,117.204229"
974,枣庄征骋汽车销售服务有限公司,0632-3789999,枣庄市西外环南园立交桥北600米路西,370400,枣庄市,370000,山东省,"34.874972,117.535669"
