id,name,telphone,address,city-region,city,province-region,province,place
738,莱阳市弘源汽车销售服务有限公司,0535-7333222,莱阳市开发区118号,370600,烟台市,370000,山东省,"36.946803,120.644909"
852,烟台荣通汽车贸易有限公司,0535-6023158,烟台市芝罘区机场路39-1号,370600,烟台市,370000,山东省,"37.4956848,121.370059"
976,烟台荣悦汽车销售服务有限公司,0535-6833888,烟台市芝罘区幸福南路7-5号,370600,烟台市,370000,山东省,"37.565205,121.341845"
1075,莱州市利源汽车销售有限公司,0535-2298701/2281551,山东神莱州市开发区城港南路1299号,370600,烟台市,370000,山东省,"37.2216021,119.948025"
1110,龙口市东平汽车服务有限公司,0535-8618366,龙口市南山路1162号,370600,烟台市,370000,山东省,"37.619889,120.510703"
647,潍坊华通汽车销售有限公司,0536--8661080,潍城经济开发区309国道以南彩虹路以西（潍城区政府对面）,370700,潍坊市,370000,山东省,"36.729503,119.032909"
782,潍坊华冠汽车销售服务有限公司,0536-2266088,山东省安丘市双丰大道永安路交叉口东行800米路南,370700,潍坊市,370000,山东省,"36.40895,119.229113"
971,寿光华骏汽车销售服务有限公司,0536-5500096,山东省寿光市潍高路与北环路交叉口路南,370700,潍坊市,370000,山东省,"36.898029,118.697586"
981,青州宝亨汽车贸易有限公司,0536-3520277,青州市玲珑山北路2288号,370700,潍坊市,370000,山东省,"36.742967,118.487795"
1009,潍坊隆运汽贸有限公司,0536-2216699,山东省高密市夷安大道8888号,370700,潍坊市,370000,山东省,"36.443065,119.789891"
1094,诸城市盛邦汽车销售服务有限公司,6430868,诸城市西外环与北外环交叉口（桥头部队）路西50米路南,370700,潍坊市,370000,山东省,"36.03113,119.371994"
1141,潍坊华瑞汽车销售服务有限公司,0536-8110001,潍坊市奎文区潍州路418号（金宝乐园南行2公里路西）,370700,潍坊市,370000,山东省,"36.648624,119.137072"
678,梁山铭浩汽车销售服务有限公司,0537-6592299,山东省济宁市梁山县水浒大道与G220国道交汇处向西500米南侧,370800,济宁市,370000,山东省,"35.760019,116.115569"
958,济宁辰鑫汽车销售服务有限公司,0537-3167779,济宁市崇文大道1号东艺工业园内,370800,济宁市,370000,山东省,"35.427662,116.675039"
1173,济宁启华汽车销售服务有限公司,0537-2480333,山东省济宁市105国道金宇汽配城对过,370800,济宁市,370000,山东省,"35.432887,116.553927"
855,泰安市山利达汽车销售有限公司,0538-6661500,泰安市泰山区省庄东部开发区科技中路86号,370900,泰安市,370000,山东省,"36.217671,117.208505"
1103,新泰宝达汽车销售服务有限公司,0538-7188111,山东省新泰市开发区新兴路千米立井南邻,370900,泰安市,370000,山东省,"35.892607,117.734694"
657,威海金阳光振洋汽车销售服务有限公司,0631-5911666,威海市临港区金阳光汽博城7号 起亚店,371000,威海市,370000,山东省,"37.331388,122.147275"
939,威海荣佳汽车贸易有限公司,0631-5961688,山东省威海市珠海路650号,371000,威海市,370000,山东省,"37.41482,122.157162"
1134,文登荣达汽车销售服务有限公司,0631-8770999,文登区九里国际汽车城迎宾路1号东风悦达起亚,371000,威海市,370000,山东省,"37.248603,122.05214"
813,日照悦启汽车销售服务有限公司,0633-3673333,日照市日照北路日照一中向北800米,371100,日照市,370000,山东省,"35.454523,119.471178"
739,莱芜市鑫悦汽车销售服务有限公司,0634-6639999,山东省莱芜市莱城工业区汽车商贸城,371200,莱芜市,370000,山东省,"36.293385,117.657899"
705,临沂瑞驰汽车销售服务有限公司,0539-8179010,临沂市兰山区蒙山大道与平安路交汇南100米路东,371300,临沂市,370000,山东省,"35.049814,118.319179"
850,山东中汽贸易有限公司,0539-7061555,山东省临沂市金九路与沂州路交汇处西500米路南,371300,临沂市,370000,山东省,"35.020946,118.354179"
1117,临沂启华汽车销售服务有限公司,0539-7678877,临沂市河东区温泉路与金桥街交汇处河东汽车超市,371300,临沂市,370000,山东省,"35.103181,118.43674"
703,禹城市博大汽车销售有限公司,0534-7727188,禹城市南外环杨庄大桥东侧200米省道101路北,371400,德州市,370000,山东省,"36.923432,116.621412"
929,德州中冀高级汽车销售有限责任公司,0534-2553398,山东省德州市德城区天衢东路金华茶城本门东侧,371400,德州市,370000,山东省,"37.45876,116.375294"
1152,德州华耀汽车销售有限公司,0534-8398888,山东省德州市德城区东风中路389号,371400,德州市,370000,山东省,"37.448945,116.325485"
938,聊城北斗汽车商贸有限公司,0635-8358888,山东省聊城市经济开发区东昌东路169号,371500,聊城市,370000,山东省,"36.465701,116.071449"
1127,聊城市圣源汽车销售服务有限公司,0635-5096666,聊城市光岳北路（江北汽车城斜对过）,371500,聊城市,370000,山东省,"36.483256,116.033494"
707,邹平福骋汽车贸易有限公司,0543-5065666,邹平县黛溪街道办事处马庄村,371600,滨州市,370000,山东省,"36.913479,117.738423"
940,滨州运通汽车销售有限公司,0543-3479777,滨州市滨城区北外环路中段北侧,371600,滨州市,370000,山东省,"37.442278,118.023575"
602,郓城亿隆汽贸有限公司,0530-6717777,山东省菏泽市郓城县经济开发区开拓路西段路北,371700,菏泽市,370000,山东省,"35.58566,115.976256"
653,菏泽铂亚达汽车销售服务有限公司,0530-6273666,山东省菏泽市定陶县车管所北临范蠡国际汽车城,371700,菏泽市,370000,山东省,"35.118478,115.596361"
984,菏泽正通汽贸有限公司,0530-5602766,牡丹区昆明路中段,371700,菏泽市,370000,山东省,"35.268203,115.56267"
1161,菏泽祥瑞汽贸有限公司,0530-6292999,山东省菏泽市黄河东路800号正大汽车广场（车管所东两公里路南）,371700,菏泽市,370000,山东省,"35.269488,115.563622"
645,河南臻宝汽车贸易有限公司,0371-56173333,郑州市金水区中州大道与光明路（原柳林东路）向西300米路北,410100,郑州市,410000,河南省,"34.83696,113.695425"
697,河南亚琪汽车贸易有限公司,0371-64391118,北京市朝阳区南四环东路49号,410100,郑州市,410000,河南省,"34.7792,113.020645"
716,新郑市汇昌汽车销售服务有限公司,0371-85125888,新郑市郑韩路西段路北366号,410100,郑州市,410000,河南省,"34.4113,113.717332"
787,郑州恒信国亚汽车销售服务有限公司,0371-55050008,郑州市南三环与文治路交叉口南800米,410100,郑州市,410000,河南省,"34.696255,113.729502"
788,河南普泽汽车销售服务有限公司,0371-86521188,郑州市郑东新区黄河南路与经北六路交叉口,410100,郑州市,410000,河南省,"34.739876,113.755716"
868,河南新裕隆汽车销售服务有限公司,0371-65590188,郑州市郑花路北段河南汽车贸易中心院内(东风悦达起亚河南裕隆4S店),410100,郑州市,410000,河南省,"34.869483,113.683883"
869,河南广发汽车销售服务有限公司,0371-56581555,中原西路与杭州路交叉口向西1公里路北大中原国际汽车城C区 东风悦达起亚郑州广发4S店,410100,郑州市,410000,河南省,"34.795031,113.60105"
915,河南万盛汽车销售服务有限公司,0371-69169111,郑州市郑汴路116号中博汽车广场北门,410100,郑州市,410000,河南省,"34.756524,113.714706"
706,开封市万宝麒麟汽车销售有限公司,0371-26652666 / 0371-26712999,祥符区310国道与园区路交叉口向北200米路西（开封县新人民检察院对面）,410200,开封市,410000,河南省,"34.750535,114.463657"
923,开封中悦汽车销售服务有限公司,0371-22267555,开封市金明大道与东京大道交叉(新河南大学)转盘东北角,410200,开封市,410000,河南省,"34.830181,114.309752"
606,洛阳起亚普华汽车销售服务有限公司,0379-65525566,洛阳市洛龙区政和路1号,410300,洛阳市,410000,河南省,"34.628082,112.475956"
784,洛阳市德众中亚汽车销售服务有限公司,0379-69978666,洛阳市西工区汉宫路5号,410300,洛阳市,410000,河南省,"34.695029,112.420833"
985,洛阳悦达汽车有限公司,0379-65278008,洛阳市e河区九都东路名车苑,410300,洛阳市,410000,河南省,"34.6865612,112.515284"
1163,洛阳市天之凯汽车销售有限公司,0379-65266688,河南省洛阳市洛龙区洛龙科技园园西大道众德慧汽车城合资2号,410300,洛阳市,410000,河南省,"34.5831120000,112.3835680000"
1029,平顶山市亚新源汽车销售服务有限公司,0375-3288777,河南省平顶山市建设路东段与开发路交叉口向西50米路南,410400,平顶山市,410000,河南省,"33.7387623,113.390467"
1213,河南浩博路通汽车销售服务有限公司,0375-7353666,河南省平顶山市舞钢市建设路西段半山刘村北（原铁山乡客运院内）,410400,平顶山市,410000,河南省,"33.338978,113.533276"
639,林州东盛弘顺汽车销售有限公司,0372-6133666,林州市南林高速口西1000米路南,410500,安阳市,410000,河南省,"36.062665,113.948671"
1165,安阳市悦睿汽车销售服务有限公司,0372-2116888,安阳市梅东路与文昌大道交叉口,410500,安阳市,410000,河南省,"36.079288,114.310134"
676,长垣大信汽车贸易有限公司,0373-8818999,长垣县山海大道中段,410700,新乡市,410000,河南省,"35.1843,114.653301"
956,新乡市诚盛汽车销售服务有限公司,0373-3537878,新乡市南环路与新飞大道交叉口南环汽车广场院内,410700,新乡市,410000,河南省,"35.266056,113.905657"
968,焦作交运集团富隆汽车销售服务股份有限公司,0391-3563999,焦作市迎宾路沙河桥南富源汽车城,410800,焦作市,410000,河南省,"35.161308,113.269769"
1234,濮阳市瑞晨汽车销售有限公司,0393-4499888,河南省濮阳市中原路与濮水路交叉口东南角,410900,濮阳市,410000,河南省,"35.787788,114.984958"
641,许昌通富汽贸有限公司,0374-8021666,许昌市前进路与许州路交叉口汽车公园内,411000,许昌市,410000,河南省,"34.026127,113.897124"
829,许昌正达汽车销售服务有限公司,0374-3123888,河南省许昌市许由路与延安路交叉口向东300米路北,411000,许昌市,410000,河南省,"34.0098570000,113.8622430000"
1226,漯河润隆汽车销售服务有限公司,0395-3396111,河南省漯河市舞阳县张家港路东段南侧（龙田精密仪器厂西邻）,411100,漯河市,410000,河南省,"33.451878,113.642875"
695,灵宝天紫汽车销售服务有限公司,0398-8659000,灵宝市长安路汽车商贸城,411200,三门峡市,410000,河南省,"34.540524,110.86618"
783,南阳天翊汽车销售服务有限公司,0377-68833333,南阳市北京路北段气象局向北500米路东,411300,南阳市,410000,河南省,"33.029323,112.504254"
1245,南阳兴源汽车销售服务有限公司,0377-67057666,南阳市B11路与经十三路交叉口双铺超站对面泰祥汽车城内,411300,南阳市,410000,河南省,"32.9645140000,112.6031130000"
751,商丘市铭悦汽车销售服务有限公司,0370-3991777,商丘市北海路与星林路交汇处,411400,商丘市,410000,河南省,"34.399854,115.703286"
992,商丘市佳瑞汽车销售服务有限公司,0370-2589911,河南省商丘市平原路86号,411400,商丘市,410000,河南省,"34.455759,115.602055"
1111,永城市羿天汽车销售有限公司,0370-5430889,永城市芒山南路春雨汽车城内,411400,商丘市,410000,河南省,"33.9077172,116.329719"
626,信阳旭日汽车销售服务有限公司,0376-3573333,信阳市312国道与京港澳高速路口交汇处向西500米路南,411500,信阳市,410000,河南省,"32.132744,114.207344"
1054,信阳悦达起亚汽车销售服务有限公司,0376-3711111,河南省信阳市羊山新区312国道银钱村,411500,信阳市,410000,河南省,"32.132135,114.155926"
1214,潢川县鸿悦汽车销售服务有限公司,0376-3118111,河南省信阳市潢川县三环路黄锈集团西侧,411500,信阳市,410000,河南省,"32.150712,115.054049"
629,周口乐达汽车销售服务有限公司,0394-8687788,大庆路与北环路交叉口向东200米路北,411600,周口市,410000,河南省,"33.657194,114.67853"
1229,周口普泽汽车销售服务有限公司,0394-8961888,河南省周口市川汇区中州大道与太昊路交叉口西北角,411600,周口市,410000,河南省,"33.5992040000,114.6418610000"
1185,驻马店市老黑汽车销售服务有限公司,0396-3507777,驿城大道与开源大道交叉口路北200米西,411700,驻马店市,410000,河南省,"33.021459,114.067606"
797,潜江市如日中正汽车贸易有限公司,0728-6492580,潜江市潜阳西路39号天驰汽车城A5-1,419000,省直辖县级行政区划,420000,湖北省,"30.421158,112.870244"
1065,济源市贰仟家昌达汽车销售服务有限公司,0391-6609878,济源市沁园北路（二水厂北200米路东）,419000,省直辖县级行政区划,410000,河南省,"35.106385,112.615072"
812,武汉励嘉汽车服务有限公司,027-86361888,武汉市洪山区和平乡铁机村2号附3号,420100,武汉市,420000,湖北省,"30.599638,114.376043"
865,武汉汇杰汽车销售服务有限公司,027-84673923,湖北省武汉市汉阳大道蔡甸方向董家店村特1号（东风悦达起亚汇杰专营店）,420100,武汉市,420000,湖北省,"30.564611,114.160258"
866,武汉翔仕汽车服务有限公司,027-86368816,武汉市洪山区南湖大道66号,420100,武汉市,420000,湖北省,"30.486267,114.353619"
966,武汉悦莱汽车服务有限公司,027-83911515,武汉市江岸区黄浦科技园特16号,420100,武汉市,420000,湖北省,"30.632924,114.286436"
1116,武汉泽泰汽车销售服务有限公司,027-86698888,湖北省武汉市武昌江夏区藏龙岛九凤街1号,420100,武汉市,420000,湖北省,"30.437633,114.420085"
1197,桐庐昌炎汽车销售服务有限公司,0728-3206233,浙江省桐庐县白云源路1555号（世纪车城内）,420100,武汉市,420000,湖北省,"29.791552,119.693"
994,黄石市恒天盛汽车销售服务有限公司,0714-6398888,湖北省黄石市大泉路168号,420200,黄石市,420000,湖北省,"30.217198,115.01705"
597,湖北智阳物资贸易有限公司,0719-8266686,湖北省十堰市茅箭区和谐大道中段,420300,十堰市,420000,湖北省,"32.608676,110.863844"
920,宜昌华星中南汽车销售服务有限公司,0717-6903066,湖北省宜昌市西陵区发展大道69号（易中建材市场易陶馆1号楼）,420500,宜昌市,420000,湖北省,"30.734861,111.34505"
1202,宜都远征汽车销售有限公司,0717-4908655,湖北省宜都市姚家店镇姚家店村一组民富汽车城内东风悦达起亚4S店,420500,宜昌市,420000,湖北省,"30.374144,111.456517"
715,襄阳佳乐宝汽车销售服务有限公司,0710-3078666,襄阳市富康大道南深圳工业园名车城,420600,襄阳市,420000,湖北省,"32.123355,112.259047"
1002,襄阳金驹汽车销售服务有限公司,0710-3317789,襄阳市邓城大道东段襄阳新城对面,420600,襄阳市,420000,湖北省,"32.102277,112.191976"
1058,湖北荆门大富豪汽车贸易有限公司,0724-2496999,湖北省荆门市虎牙关大道2-5号,420800,荆门市,420000,湖北省,"31.010706,112.210766"
1220,湖北长惠汽车商贸有限公司,0712-8392389,湖北省汉川市滨湖大道9号（东风悦达起亚长惠特约店）,420900,孝感市,420000,湖北省,"30.673522,113.837699"
1227,利辛县迎宾汽车销售服务有限公司,0558-8866008,湖北省汉川市滨湖大道9号（东风悦达起亚长惠特约店）,420900,孝感市,420000,湖北省,"30.648069,113.807412"
1240,孝感元秀汽车销售服务有限公司,0712-2687666,湖北省孝感市孝汉大道6号 ,420900,孝感市,420000,湖北省,"30.9359710000,113.9599190000"
1078,荆州市天颐汽车销售服务有限公司,0716-8492555,荆州市荆州区荆沙大道草市渔场地段,421000,荆州市,420000,湖北省,"30.360952,112.240343"
1205,公安县锦悦汽车销售服务有限公司,0716-5233555,湖北省荆州市公安县恒盛国际汽配城2号楼,421000,荆州市,420000,湖北省,"30.059454,112.207002"
811,黄冈道全安汽车销售服务有限公司,0713-8341677,黄冈市黄州区南湖农场榨舟山,421100,黄冈市,420000,湖北省,"30.452457,114.98552"
1242,随州市孛冉汽车销售服务有限公司,0722-3285888,湖北省随州市交通大道K155号,421300,随州市,420000,湖北省,"31.6971400000,113.4266640000"
1059,恩施宏源瑞驰汽车销售服务责任有限公司,0718-8419222,湖北省恩施市金桂大道133号,422800,恩施土家族苗族自治州,420000,湖北省,"30.328341,109.502691"
601,天门悦鑫汽车销售服务有限公司,0728-5809939,湖北省天门市竟陵街道东环路承天国际车城C3-1,429000,省直辖县级行政区划,420000,湖北省,"30.676618,113.199674"
637,湖南腾飞美达汽车销售服务有限公司,0731-82906555,湖南长沙岳麓区麓谷汽车世界B-7,430100,长沙市,430000,湖南省,"28.216326,112.864989"
719,湖南东润汽车贸易有限公司,0731-83227888,浏阳市花炮大道汽车西站往太平桥方向600米,430100,长沙市,430000,湖南省,"28.15861,113.599484"
750,长沙九亚汽车销售服务有限公司,0371-88557700,长沙市望城区金星北路四段599号（大湖林场附近）,430100,长沙市,430000,湖南省,"28.319836,112.897678"
867,湖南天润凯达汽车销售服务有限公司,4000-198-777,湖南省长沙市中南汽车世界H16号,430100,长沙市,430000,湖南省,"28.242293,113.074369"
1129,湖南九达汽车销售服务有限公司,0731-88812111,湖南省长沙市岳麓区含浦镇（猴子石大桥往长潭西高速方向三公里）,430100,长沙市,430000,湖南省,"28.148313,112.921752"
1168,湖南省珈同汽车贸易有限公司,0731-87542999,长沙市宁乡县白马桥乡白马村大塘组（白龙大道旁）,430100,长沙市,430000,湖南省,"28.242447,112.54064"
1241,湖南兰天天亚汽车销售有限公司,0731-88277607,长沙高新开发区岳麓西大道3599号雷锋街道兰天汽车文化园11号栋102室,430100,长沙市,430000,湖南省,"28.2492110000,112.7942980000"
672,攸县金骏汽车销售服务有限公司,0731-24256699,湖南省株洲市攸县湘东汽贸城侧（东风悦达起亚4S店）,430200,株洲市,430000,湖南省,"26.9825,113.347719"
1020,湖南金凯汽车贸易有限公司,22208222,湖南株洲市天元区栗雨工业园金凯路7号,430200,株洲市,430000,湖南省,"27.842859,113.098554"
1024,湘潭市九亚汽车销售服务有限公司,0731-52728988,湖南省湘潭市九华示范区湘望路2号,430300,湘潭市,430000,湖南省,"27.939871,112.942435"
1050,衡阳市超强汽车销售服务有限公司,0734-8439666,湖南省衡阳市蒸湘区杨柳村二组,430400,衡阳市,430000,湖南省,"26.878208,112.57956"
1045,邵阳顺驰汽车销售服务有限公司,0739-5187171,湖南省邵阳市邵阳大道大兴路口北侧100米,430500,邵阳市,430000,湖南省,"27.260919,111.557051"
773,岳阳广宇汽车销售服务有限公司,0730-8918333,岳阳市巴陵东路八字门汇沣家居城A区,430600,岳阳市,430000,湖南省,"29.428747,113.179489"
1219,华容县东南盛达汽车销售服务有限公司,0730-4265222,湖南省岳阳市华容县胜峰乡珠头山村/414200,430600,岳阳市,430000,湖南省,"29.5393910000,112.6273690000"
770,常德双星星悦汽车销售服务有限公司,0736-2693888、,湖南省常德市常德大道德山樟木桥段（康乐加油站旁）,430700,常德市,430000,湖南省,"28.933481,111.729171"
960,常德市东亚汽车服务有限公司,0736―7776921,常德市湘西北汽贸城龙港北路（丁玲公园斜对面）,430700,常德市,430000,湖南省,"29.074369,111.681235"
1201,澧县湘北汽车城有限公司,0736-3226199,澧县津澧大道与十一支交汇处湘北汽车起亚店,430700,常德市,430000,湖南省,"29.646321,111.739429"
757,张家界九亚汽车销售服务有限公司,0744-8780333 / 0744-8780555,湖南省张家界市阳湖坪工业园九城汽车大世界（长张高速收费站）,430800,张家界市,430000,湖南省,"29.139546,110.564155"
1046,益阳晓园华美汽车销售服务有限公司,0737-2222777,湖南省益阳市赫山区十洲路（农业发展银行旁）,430900,益阳市,430000,湖南省,"28.576603,112.398164"
623,郴州鹏洋恒达汽车销售服务有限公司,0735-2629999,湖南省郴州市苏仙区郴州大道与京珠高速交汇处,431000,郴州市,430000,湖南省,"25.778631,113.075875"
979,郴州华悦贸易有限责任公司,0735-2119777,湖南省郴州市开发区万华路1号,431000,郴州市,430000,湖南省,"25.759054,113.003984"
1081,怀化燕兴汽贸有限公司,0745-2295599,湖南省怀化市鹤城区南环路（廉租房正对面）,431200,怀化市,430000,湖南省,"27.525577,109.990548"
983,娄底市华新汽车销售服务有限公司,0738-8379333, 娄底市湘阳路棉纺厂前50米,431300,娄底市,430000,湖南省,"27.741564,112.04599"
718,吉首晓园汽车销售服务有限公司,0743-8662888,吉首市大田湾肖家坪永通汽贸城,433100,湘西土家族苗族自治州,430000,湖南省,"28.306805,109.763298"
609,广州市悦达汇创汽车销售服务有限公司,020-36403686,白云区黄石东路701号,440100,广州市,440000,广东省,"23.210215,113.289136"
612,广州胜亚汽车销售服务有限公司,020-84767666,广州市番禺区番禺大道冼庄立交南300米瑞华汽车城内,440100,广州市,440000,广东省,"22.987601,113.362625"
690,广州新宏盛汽车服务有限公司,020-82679938,广州市增城区新塘107国道太平洋工业区路段,440100,广州市,440000,广东省,"23.12742,113.583068"
856,广东起骏汽车贸易有限公司,82328300,广州市天河区黄埔大道东255号,440100,广州市,440000,广东省,"23.116683,113.406679"
1011,广州市车粉丝汽车贸易有限公司,020-37088818/37084788,广州市天河区广汕路元岗路段广州汽车市场内,440100,广州市,440000,广东省,"23.1870806,113.358261"
1101,广州市起悦汽车贸易有限公司,020-86970663,广州市花都区建设北路238号（众赢汽车城内）,440100,广州市,440000,广东省,"23.430616,113.221384"
942,韶关市致达汽车销售服务有限公司,0751-8263303/0751-8263313,韶关市浈江区南郊四公里亿华汽车世界内,440200,韶关市,440000,广东省,"24.768987,113.593075"
704,深圳润朋汽车销售服务有限公司,0755-27378877,深圳市宝安区福永街道107国道与怀德南路交汇处2号,440300,深圳市,440000,广东省,"22.662877,113.83323"
898,深圳市汇天源机电设备有限公司,0755-83052528,深圳市福田区红荔西路联合华鹏汽车广场B2-2A,440300,深圳市,440000,广东省,"22.547705,114.03842"
941,深圳市兴唐投资发展有限公司,0755-89731278,深圳市龙岗区横岗镇信仪汽车城38号,440300,深圳市,440000,广东省,"22.673666,114.231349"
1026,珠海市广大昌汽车销售有限公司,0756-3835333,珠海市香洲区前山工业区华威路100号,440400,珠海市,440000,广东省,"22.289563,113.505115"
857,汕头市驰恒汽车有限公司,0754-88811688,汕头市长平路191号（即火车铁路旁）,440500,汕头市,440000,广东省,"23.368734,116.763398"
605,佛山市东众汽车销售服务有限公司,0757-87785225,佛山市三水区南丰大道18号,440600,佛山市,440000,广东省,"23.216507,112.925725"
904,佛山市富亚汽车销售服务有限公司,0757-88033888,佛山市禅城区佛山大道国际车城北区3座2号,440600,佛山市,440000,广东省,"23.0132213,113.105902"
1166,佛山市和威达汽车销售服务有限公司,0757-81857719,广东省佛山市南海区桂城海八路华南汽车城G12-11,440600,佛山市,440000,广东省,"23.073514,113.133971"
725,湛江市东森汽车销售服务有限公司,0759-3107667,广东省湛江市赤坎区双港路15号,440800,湛江市,440000,广东省,"21.303051,110.378344"
858,茂名市东方汽车销售服务有限公司,0668-2730333,茂名市茂水路279号（亿泰汽车城）,440900,茂名市,440000,广东省,"21.635545,110.919921"
1191,肇庆市粤顺达汽车销售服务有限公司,0758-2706928,肇庆市端州区黄岗镇大冲321国道侧,441200,肇庆市,440000,广东省,"23.106023,112.50181"
769,惠州市瑞涛汽车贸易有限公司,0752-2311333,惠州市三栋镇惠南汽车城对面,441300,惠州市,440000,广东省,"22.982277,114.458586"
1118,惠州市辉达汽车贸易有限公司,0752-5815888,惠州市惠城区河南岸大汽车市场内,441300,惠州市,440000,广东省,"23.069054,114.423412"
1119,惠州市润泰投资有限公司,0752-3813999,惠州市惠阳区淡水镇古屋高屋村平龙公路旁,441300,惠州市,440000,广东省,"22.81956,114.500731"
1204,惠州市博骏汽车有限公司,0752-6211999,广东省惠州市博罗县罗阳镇广汕公路旁（联运大厦对面）辉达汽车城起亚店,441300,惠州市,440000,广东省,"23.175034,114.270879"
916,梅州市春天起亚汽车销售服务有限公司,0753-2368111,广东省梅州市环市西路春天汽车城,441400,梅州市,440000,广东省,"24.332094,116.103849"
1108,河源市新英达汽车销售服务有限公司,0762-2859806,河源市河埔大道西细女抱蔬地段,441600,河源市,440000,广东省,"23.716713,114.702225"
1004,阳江市德诚起亚汽车销售服务有限公司,0662-2888999,阳江市华侨新村8路69号,441700,阳江市,440000,广东省,"21.878385,111.979311"
1000,清远市骏飞汽车销售服务有限公司,0763-3388883,广东省清远市新城B28号区奇鸿汽车城5号,441800,清远市,440000,广东省,"23.666397,113.064375"
1215,英德市粤海汽车销售服务有限公司,0763-2271818,英德市英城浈阳路城西派出所后背侧面第一卡,441800,清远市,440000,广东省,"24.187944,113.390869"
