id,name,telphone,address,city-region,city,province-region,province,place
611,东莞市福幸汽车销售服务有限公司,0769-38833070,广东省东莞市厚街镇三屯村s256省道三屯派出所旁,441900,东莞市,440000,广东省,"22.959792,113.691405"
674,东莞市常平汇天源汽车销售服务有限公司,0769-86008808/ 0769-86008811,广东东莞常平环常西路金美路段,441900,东莞市,440000,广东省,"22.964873,113.971512"
859,东莞市永濠汽车销售服务有限公司,0769-22904888,东莞市南城区莞太大道周溪路段208号,441900,东莞市,440000,广东省,"22.99949,113.725783"
899,东莞市汇天源汽车销售服务有限公司,0769-83269292,东莞市寮步镇国际汽车城A-01-05（起亚4S中心）,441900,东莞市,440000,广东省,"23.018403,113.855793"
987,东莞市东众实业有限公司,0769-82770999,东莞市塘厦镇塘厦大道北223号,441900,东莞市,440000,广东省,"22.851894,114.102228"
1192,东莞市永泰汽车有限公司,0769-81689558/81689559,广东省东莞市虎门镇莞太大道白沙路段248号,441900,东莞市,440000,广东省,"22.861723,113.682929"
860,中山市永奥汽车贸易有限公司,0760-88282808,中山市火炬开发区大岭中山汽车城内,442000,中山市,440000,广东省,"22.537259,113.46035"
1049,中山市悦雅汽车贸易有限公司,0760-22822922,中山市东升镇坦背105国道达兴汽车城内,442000,中山市,440000,广东省,"22.5823852,113.328318"
1007,潮州市中正汽车贸易有限公司,0768-2981818,浮洋镇潮汕公路乌洋路段乌洋市场斜对面，东风悦达起亚潮州中正店,445100,潮州市,440000,广东省,"23.610183,116.606915"
906,揭阳市荣通汽车贸易有限公司,0663-8222006,广东省揭阳市环市北路与新河路交界处,445200,揭阳市,440000,广东省,"23.574008,116.389414"
832,云浮市华粤汽车销售服务有限公司,0766-8333300,广东省云浮市云城区云城街大i村委机械城侧,445300,云浮市,440000,广东省,"22.921898,112.02783"
604,广西普鑫泽源汽车销售服务有限公司,0771-2807778,沙井大道92号东风悦达起亚普鑫泽源专营店,450100,南宁市,450000,广西壮族自治区,"22.786832,108.258404"
801,广西弘顺汽车销售服务有限公司,7713949386,广西南宁市秀厢大道199号金源汽车城内,450100,南宁市,450000,广西壮族自治区,"22.869611,108.36911"
864,广西通惠汽车销售服务有限公司,0771-2244666,广西南宁市白沙大道69号,450100,南宁市,450000,广西壮族自治区,"22.78218,108.303379"
1034,广西荣力汽车销售服务有限公司,0771-3212688,南宁市快环路秀厢大道22号（科德路口旁）,450100,南宁市,450000,广西壮族自治区,"22.856914,108.265212"
720,桂林新旗亚商贸有限责任公司,0773-2668788,灵川县八里街大西南汽车城八里七路11号,450300,桂林市,450000,广西壮族自治区,"25.359501,110.318127"
721,北海恒威汽车销售有限公司,0779-3990111,北海市北海大道贵航汽车城对面,450500,北海市,450000,广西壮族自治区,"21.488298,109.171875"
1169,钦州东源汽车销售服务有限公司,0777-2550222,钦州市北部湾大道大润发往北直行500米处（右侧）,450700,钦州市,450000,广西壮族自治区,"21.978508,108.618583"
624,玉林市骏利汽车销售服务有限公司,0775-2336767,广西玉林市玉州区正泰路1号,450900,玉林市,450000,广西壮族自治区,"22.649315,110.196878"
722,百色润通汽车销售服务有限公司,0776-2222099,广西百色市右江区城东大道与大旺路交汇处联润汽贸园内,451000,百色市,450000,广西壮族自治区,"23.859815,106.673395"
861,海南创亿汽车销售服务有限公司,0898-66801913,海南省海口市南海大道61号,460100,海口市,460000,海南省,"20.0013166,110.328309"
1157,海口智晨汽车销售服务有限公司,0898-68609900,海口市南海大道南侧华南汽车城,460100,海口市,460000,海南省,"20.001639,110.276155"
1010,三亚创元汽车销售服务有限公司,0898-38210888,三亚市迎宾大道515号东风悦达起亚专营店,460200,三亚市,460000,海南省,"18.28955,109.576098"
691,四川申蓉桂锋汽车销售服务有限公司,028-86496999,四川省成都市武侯区武侯大道南延线武兴路110号,510100,成都市,510000,四川省,"30.626641,103.983036"
696,成都宏嘉汽车销售服务有限公司,028-61283388,成都市成华区成致路1号（龙潭汽车工业园内）,510100,成都市,510000,四川省,"30.688924,104.169433"
732,四川兴天合汽车销售服务有限公司,028-82688633/ 028-82688999,成都市温江区温泉大道三段浩瀚路2号,510100,成都市,510000,四川省,"30.673747,103.856982"
825,四川骏亚汽车销售服务有限公司,028-67356999,成都市新都区蜀龙大道南段三河街道长龙社区（成发420厂与成量厂之间）,510100,成都市,510000,四川省,"30.783279,104.169462"
1146,成都锦华汽车销售有限责任公司,028-87788296,四川省成都市锦江区汽车工业园皇经楼路269号,510100,成都市,510000,四川省,"30.690366,104.172256"
1194,成都宇霖启程汽车销售服务有限公司,028-69288222,成都市金堂县金堂大道997号,510100,成都市,510000,四川省,"30.849061,104.40381"
1235,成都集大成汽车销售服务有限公司,028-82688993,四川省成都市高新区火车南站西路1701号,510100,成都市,510000,四川省,"30.5950940000,104.0362600000"
1072,自贡庞大华泓汽车销售服务有限公司,0813-8777888,四川省自贡市贡井区南环路庞大川南汽贸城内东风悦达起亚4S店,510300,自贡市,510000,四川省,"29.336346,104.712765"
1071,泸州众汇新元素车业有限公司,0830-4276366,四川省泸州市纳溪区蓝安大道顺屋基浙江工业园,510500,泸州市,510000,四川省,"28.853974,105.409336"
1210,合江兴合汽车销售服务有限公司,0830-5286999,四川省泸州四合江县榕山临港工业园区联榕坝片,510500,泸州市,510000,四川省,"28.842512,105.918451"
1003,德阳市中意汽车销售服务有限责任公司,0838-2601688,四川省德阳市旌阳区金沙江路与岷山路交汇处西北角,510600,德阳市,510000,四川省,"31.076471,104.383487"
1211,德阳市晟翔汽车销售服务有限责任公司,0838-3063888,四川省德阳市庐山南路3段38号,510600,德阳市,510000,四川省,"31.093133,104.416486"
891,四川东风南方绵达汽车销售服务有限公司,0816-2545888,绵阳市绵兴东路131号,510700,绵阳市,510000,四川省,"31.4734265393,104.6790023335"
1167,绵阳世邦汽车销售有限公司,0816-2697555,四川省绵阳市经开区绵州大道中段6号,510700,绵阳市,510000,四川省,"31.426597,104.778511"
1042,广元市金悦顺汽车销售有限公司,0839-3563666,四川省广元市下西物流园区(金顺汽车园),510800,广元市,510000,四川省,"32.420438,105.816675"
1132,遂宁骏德汽车有限公司,0825-2376333,四川省遂宁市船山区中国西部现代物流港内（出高速公路遂宁南收费站右转300米）,510900,遂宁市,510000,四川省,"30.460388,105.571853"
599,内江悦嘉汽车销售服务有限公司,0832-2157888,内江市经济技术开发区汉兴路366号,511000,内江市,510000,四川省,"29.576173,105.010588"
1095,乐山天牛东亚汽车销售服务有限公司,0833- 2306066,四川省乐山市市中区通江镇王河村3组,511100,乐山市,510000,四川省,"29.617497,103.743549"
759,南充明云跃起车业有限公司,0817-3357077,四川省南充市高坪区机场大道东顺路68号,511300,南充市,510000,四川省,"30.775958,106.177405"
989,南充一品天成车业有限公司,0817-2516666,四川省南充市顺庆区潆溪镇杨家桥村一社,511300,南充市,510000,四川省,"30.885339,106.059244"
1223,阆中市华志汽贸有限公司,0817-6577566,四川省南充市阆中市七里大道389号（孙家垭收费站旁）,511300,南充市,510000,四川省,"31.550396,106.008173"
760,宜宾安鸿吉亚汽车销售服务有限公司,0831-8886119/ 0831-8880919,四川省宜宾市临港经济开发区飞云路北段安吉汽车城,511500,宜宾市,510000,四川省,"28.801833,104.668348"
1105,达州梁材汽车销售服务有限公司,0818-3736666,四川省达县南外新桥村唐家湾,511700,达州市,510000,四川省,"31.17687,107.514452"
1221,大竹虹辉汽车贸易有限公司,0818-6222766,四川省达州市大竹县东柳乡东柳村9组（西大街柳桥路167号）,511700,达州市,510000,四川省,"30.7488249840,107.2501908693"
790,雅安市百美汽车销售服务有限公司,0835-2610666,四川省雅安市雨城区多营镇下坝村5号,511800,雅安市,510000,四川省,"29.994267,102.962792"
688,巴中圣鞍汽车销售服务有限公司,0827-5013777,巴中市黄家沟西部国际商贸城先锋汽车产业园区,511900,巴中市,510000,四川省,"31.854484,106.812685"
1154,资阳辰宇飞亚汽车销售服务有限公司,028-26602888,四川省资阳市雁江区外环路南段（新四海公司旁）,512000,资阳市,510000,四川省,"30.115525,104.616574"
977,西昌航天车业有限责任公司,0834－2509866,四川省凉山州西昌市名族风情园中路1号,513400,凉山彝族自治州,510000,四川省,"27.878924,102.256772"
635,贵州瀚羿睿宁汽车销售服务有限公司,0851-82543599,贵阳清镇汽车贸易城（贵州省贵阳市金马大道旁）,520100,贵阳市,520000,贵州省,"26.569004,106.511155"
793,贵州华亚新汽车贸易服务有限公司,0851-8334888,贵州省贵阳市花溪区孟关国际汽贸城,520100,贵阳市,520000,贵州省,"26.410151,106.753121"
890,贵州华通华悦汽车贸易服务有限公司,0851-4721666,贵州省贵阳市金阳南路118号,520100,贵阳市,520000,贵州省,"26.597404,106.638387"
795,贵州宏宇嘉和汽车贸易有限公司,0858-8167111,贵州省六盘水市钟山经济开发区红桥新区红山大道南客站斜对面,520200,六盘水市,520000,贵州省,"26.543608,104.911344"
610,遵义华悦通汽车销售有限公司,0851-28797778,贵州省遵义市汇川区董公寺汽车商贸城,520300,遵义市,520000,贵州省,"27.786212,106.927798"
950,遵义白天鹅汽车销售有限公司,0852-7357000,遵义县龙坑镇黔北国际汽车博览城,520300,遵义市,520000,贵州省,"27.601976,106.87587"
820,铜仁市华新汽车销售服务有限公司,0856-3235333,铜仁市谢桥新区铜大高速南出口处500米,522200,铜仁地区,520000,贵州省,"27.690651,109.172748"
1041,贵州林富汽车贸易有限责任公司,0859-3626888,贵州省兴义市坪东大道95号,522300,黔西南布依族苗族自治州,520000,贵州省,"25.099906,104.884528"
708,毕节市兴辉汽车销售有限责任公司,0857-7116777,贵州省毕节市双山新区小瓦路8号,522400,毕节地区,520000,贵州省,"27.271177,105.453263"
1160,贵州省黔东南州恒铃源汽车销售有限责任公司,0855-8517333,凯里市迎宾大道69号,522600,黔东南苗族侗族自治州,520000,贵州省,"26.571683,107.964778"
702,黔南州创力东风汽车贸易有限公司,0854-8580899/ 0854-8580898,贵州省都匀市甘塘创力汽车广场起亚4S店,522700,黔南布依族苗族自治州,520000,贵州省,"26.314828,107.467503"
1209,福泉市致悦汽车销售服务有限公司,0854-2225688,贵州省黔南布依苗族自治州福泉市洒金大道国际汽车城1号楼一、二层 /邮编550599,522700,黔南布依族苗族自治州,520000,贵州省,"26.7186890000,107.5162520000"
646,云南中星汽车销售服务有限公司,0871-67396738,云南省昆明市官渡区彩云北路7452号，云秀路与珥季路中间，中石油加油站旁,530100,昆明市,530000,云南省,"24.96975659,102.7733359"
885,云南谊和汽车经贸有限公司,0871-68329050,昆明市二环西路668号黄土坡烟草兴云汽车城内,530100,昆明市,530000,云南省,"25.075495,102.672606"
886,云南都市车迷苍峨汽车工贸有限公司,0871―65703358,昆明市盘龙区北京路延长线1048号,530100,昆明市,530000,云南省,"25.085357,102.736224"
1150,云南吉至汽车销售有限公司,（0871）3313881,昆明市经开区国际汽车城C-03号,530100,昆明市,530000,云南省,"24.964867,102.810054"
794,宣威捷昱汽车销售服务有限公司,400-0874-338,云南省宣威市东大街（滇能大酒店对面),530300,曲靖市,530000,云南省,"26.225563,104.111162"
917,曲靖谊和汽车经贸有限公司,0874-3216811,云南省曲靖市麒麟区子午路（中央商务区）,530300,曲靖市,530000,云南省,"25.4736696,103.809381"
887,云南玉溪诚达汽车销售服务有限公司,0877-6102099,玉溪市玉带路17-1号,530400,玉溪市,530000,云南省,"24.364713,102.540222"
1121,昭通市滇东北机动车商贸有限公司,0870-8881655/ 0870-8881822,昭通市昭阳区团结路197号,530600,昭通市,530000,云南省,"27.328726,103.72008"
596,丽江悦鑫汽车销售服务有限公司,0888-3198666,丽江市玉龙县聚鑫路与玉泽西路交叉口(中正苑对面),530700,丽江市,530000,云南省,"26.83938,100.232177"
962,普洱鸿达悦亚汽车销售有限公司,0879-2150922,普洱市思茅区宁洱大道16号,530800,普洱市,530000,云南省,"22.824491,100.967545"
666,楚雄悦途汽车销售服务有限公司,0878-3036888,云南省楚雄市三家塘车管所旁,532300,楚雄彝族自治州,530000,云南省,"25.066166,101.504881"
991,云南红河诚达汽车销售服务有限公司,0873-7238666,云南省开远市兴远路3号,532500,红河哈尼族彝族自治州,530000,云南省,"23.708063,103.287868"
798,云南文山嘉宝汽车销售服务有限公司,0876-2146666,文山市国际汽车城（新中医院前行3公里）,532600,文山壮族苗族自治州,530000,云南省,"23.327176,104.285008"
998,大理嘉源汽车销售服务有限公司,0872-2327369,云南省大理市开发区泛亚汽车城南面,532900,大理白族自治州,530000,云南省,"25.6006435,100.269627"
694,芒市和润达程汽车销售服务有限公司,0692-2908888,云南省德宏州芒市河东路148号,533100,德宏傣族景颇族自治州,530000,云南省,"24.449911,98.609184"
921,西藏万融投资有限公司,0891-6835408,拉萨市鲁堆林卡路（八一路口东50米）,540100,拉萨市,540000,西藏自治区,"29.655935,91.084791"
665,陕西天锐盛航汽车销售服务有限公司,029-89690301/ 029-89690302,陕西省西安市长安区航天东路与工业三路十字东南角 029-89690301,610100,西安市,610000,陕西省,"34.15188,108.99689"
780,陕西长久吉盛汽车销售服务有限公司,029-86183275,西安市哄鄙态区汽车主题公园金桥三路中段,610100,西安市,610000,陕西省,"34.30990753,109.058612"
892,陕西百富通汽车服务有限公司,029-86520009,陕西省西安市经济开发区C5区凤城五路58号,610100,西安市,610000,陕西省,"34.335528,108.940405"
893,陕西恒泰汽车销售服务有限公司,029-62899999,西安市三桥经济技术开发区疏导线58号 中国西部国际车城4S店集群区,610100,西安市,610000,陕西省,"34.204805,108.944822"
1135,陕西瑞侨汽车销售服务有限公司,029-89195888,西安市西高新西部大道107号,610100,西安市,610000,陕西省,"34.1782392,108.863785"
711,铜川市星原汽车销售服务有限公司,0919-3158989,陕西省铜川市新区长丰南路,610200,铜川市,610000,陕西省,"34.906276,108.961242"
1005,宝鸡捷高恒泰贸易有限公司,0917-3613666,宝鸡市陈仓大道49号,610300,宝鸡市,610000,陕西省,"34.347868,107.287736"
643,陕西汇宁汽车贸易有限公司,029-33672000,咸阳市秦都区世纪大道以北黄家寨七组,610400,咸阳市,610000,陕西省,"34.325084,108.767216"
1122,陕西尚乘汽车贸易有限公司,029-33128000,陕西省咸阳市西兰路南上召汽车产业园,610400,咸阳市,610000,陕西省,"34.375737,108.679698"
664,陕西金渭悦泰汽车销售服务有限公司,0913-2121009,渭南市高新区乐天大街西段与新盛路十字向西300米,610500,渭南市,610000,陕西省,"34.524824,109.448655"
1001,渭南宏远恒泰汽车销售服务有限公司,0913-2092369,渭南市华山大街东段丰原路口东100米路南,610500,渭南市,610000,陕西省,"34.498393,109.533553"
622,延安汇章汽车销售服务有限公司,0911-8809688,延安市北郊陵园路合力北郊车城,610600,延安市,610000,陕西省,"36.64373689,109.4533737"
1018,延安汇宁汽车贸易有限责任公司,0911-2860666,陕西省延安市宝塔区南二十里铺柳树巷,610600,延安市,610000,陕西省,"36.519653,109.475092"
1076,汉中市恒远汽车销售有限公司,0916-2619333,陕西省汉中市汉台区石马坡什字北侧,610700,汉中市,610000,陕西省,"33.09958641,107.0261102"
804,榆林市阳光汽车发展有限公司,0912-8187711,陕西省榆林市东沙汽车产业园,610800,榆林市,610000,陕西省,"38.33566,109.863638"
978,榆林金利汽车销售服务有限公司,0912-3599555,榆林市开发区草海则村电厂路,610800,榆林市,610000,陕西省,"37.606236,108.828241"
1031,安康源瑞汽车销售服务有限公司,0915-8193333,陕西省安康市高新技术产业开发区钻石东路2号,610900,安康市,610000,陕西省,"32.722895,108.999616"
712,商洛泽泰盛世汽车销售服务有限公司,0914---2281999,陕西省商洛市商州区杨峪河镇谢塬村,611000,商洛市,610000,陕西省,"33.865925,109.894269"
772,兰州永奇汽车销售服务有限公司,0931-2361192/ 0931-2361193,兰州市七里河区南滨河中路1369号,620100,兰州市,620000,甘肃省,"36.095814,103.693079"
895,甘肃宝通汽车销售服务有限公司,0931-8383666,甘肃省兰州市大沙坪八里湾,620100,兰州市,620000,甘肃省,"36.124583,103.83171"
969,兰州悦丰汽车销售有限公司,0931-2553355,兰州市七里河区南滨河西路181号,620100,兰州市,620000,甘肃省,"36.093473,103.726856"
1153,白银钦盛汽车服务有限责任公司,0943-8281222,甘肃省白银市中科院高新技术产业园,620400,白银市,620000,甘肃省,"36.527727,104.185968"
1123,天水永欣汽车销售服务有限公司,0938-6837999,甘肃省天水市麦积区花牛镇花牛村（天水机场东侧）,620500,天水市,620000,甘肃省,"34.55974,105.876383"
663,武威铭泰汽车销售服务有限公司,0935-2566111,武威市凉州区大马大道城东工业区,620600,武威市,620000,甘肃省,"37.89990045,102.6816084"
714,张掖市天驰凯悦汽车销售服务有限责任公司,0936-5979999,张掖市东北郊工业园区昆仑大道北侧,620700,张掖市,620000,甘肃省,"38.945115,100.48699"
1098,酒泉金岛璐达汽车销售有限公司,0937-2855155,酒泉市西郊工业园区风光大厦向西3公里处,620900,酒泉市,620000,甘肃省,"39.77602906,98.3978085"
1040,庆阳晟驰汽车销售服务有限公司,0934-8888868,甘肃省庆阳市西峰区世纪大道南段,621000,庆阳市,620000,甘肃省,"35.755422,107.638188"
621,陇南协和美达汽车销售有限责任公司,0939-8898777,武都区吉石坝新区长江大道西延伸段协和汽贸城,621200,陇南市,620000,甘肃省,"33.41401008,104.858192"
758,临夏市环球顺腾汽车销售服务有限公司,0930-6289900 / 0930-6299922,甘肃省临夏州临夏市南龙镇马家庄（穆斯林物流园区）,622900,临夏回族自治州,620000,甘肃省,"35.5931054,103.2469827"
614,青海紫丰汽车销售服务有限公司,0971-7790000,青海省西宁市同安路156号,630100,西宁市,630000,青海省,"36.53630756,101.6694753"
961,青农集团青海三江源汽车贸易有限公司,0971-5226888,青海生物科技产业园海湖大道22号,630100,西宁市,630000,青海省,"36.69023706,101.7473082"
1104,青海嘉恒汽车销售有限公司,0971-8828333,青海省西宁市城东经济技术开发区昆仑东路14号,630100,西宁市,630000,青海省,"36.56836618,101.8787018"
654,格尔木广汇金屹汽车销售服务有限公司,0979-8425997,青海省格尔木市昆仑开发区广汇汽车城,632801,格尔木市,630000,青海省,"36.38942107,94.97638079"
779,银川恒信国亚汽车销售服务有限公司,0951-5660882,宁夏省银川市金凤区工业集中区创业街西侧,640100,银川市,640000,宁夏回族自治区,"38.4544598,106.1583771"
896,宁夏天利新华夏汽车连锁有限公司,0951-8988858,宁夏银川市德胜工业园区中央大道1-1号,640100,银川市,640000,宁夏回族自治区,"38.532656,106.322598"
1066,宁夏人和汽车销售服务有限公司,0951-8988758,银川市德胜工业区德鑫路,640100,银川市,640000,宁夏回族自治区,"38.542118,106.331271"
733,石嘴山恒信国亚汽车销售服务有限公司,0952-2039000,石嘴山市大武口区西环路东规划四号路北,640200,石嘴山市,640000,宁夏回族自治区,"39.025153,106.346679"
734,宁夏志成汽车销售服务有限公司,0953-2707222,宁夏省吴忠市利通区世纪大道北侧,640300,吴忠市,640000,宁夏回族自治区,"38.010441,106.227784"
607,新疆博亚天成汽车销售有限公司,0991-4169199,新疆乌鲁木齐南湖北路866号起亚4S店,650100,乌鲁木齐市,650000,新疆维吾尔自治区,"43.86236956,87.61238691"
662,新疆天宇华鑫汽车销售有限公司,0991-4189088/ 0991-6928928,新疆乌鲁木齐市经济技术开发区（头屯河区）工业园区头屯河公路2345号新疆天恒基国际汽车文化城A区2-4,650100,乌鲁木齐市,650000,新疆维吾尔自治区,"43.89750339,87.38309525"
821,新疆新旭汽车贸易有限公司,0991-6887272,新疆乌鲁木齐市米东区永顺街478号（交通学校院内）,650100,乌鲁木齐市,650000,新疆维吾尔自治区,"43.95146128,87.63855489"
894,新疆永泰祥车业贸易有限责任公司,0991-3756888,新疆维吾尔自治区乌鲁木齐市喀什西路756号附3号,650100,乌鲁木齐市,650000,新疆维吾尔自治区,"43.8843568,87.532858"
908,乌鲁木齐国奥和成汽车贸易有限责任公司,0991-6686920,乌鲁木齐市鲤鱼山北路1号赛博特国际汽车城c-5,650100,乌鲁木齐市,650000,新疆维吾尔自治区,"43.8808889,87.5996072"
1106,克拉玛依华悦起亚汽车销售服务有限公司,0990-6369518,新疆克拉玛依市西环路6号,650200,克拉玛依市,650000,新疆维吾尔自治区,"45.56364826,84.90210275"
700,吐鲁番广达汽车销售服务有限公司,0995-7602888,新疆吐鲁番地区吐鲁番市现代大道8号,652100,吐鲁番地区,650000,新疆维吾尔自治区,"43.019204,89.138035"
809,哈密市盈凯汽车销售服务有限公司,0902-2506067,哈密市广东工业园区岭南路,652200,哈密地区,650000,新疆维吾尔自治区,"42.824935,93.521008"
807,新疆昌吉汇京昌顺汽车销售服务有限公司,0994-6531668,昌吉市乌伊西路中山路街道办事处夹滩村汽车城南侧,652300,昌吉回族自治州,650000,新疆维吾尔自治区,"44.03328882,87.25192938"
1073,巴州强运汽车销售服务有限公司,0996-2708822,新疆库尔勒石化大道神州汽车城（车城美居旁）,652800,巴音郭楞蒙古自治州,650000,新疆维吾尔自治区,"41.72817775,86.21911327"
1087,阿克苏悦诚汽车销售有限公司,09972620222 / 09972620111,阿克苏市交通路25号金土地农哈哈大世界二期17号,652900,阿克苏地区,650000,新疆维吾尔自治区,"41.153026,80.303943"
710,喀什永祥起亚汽车销售有限公司,0998-6539008 6539009,新疆维吾尔自治区喀什地区疏勒县齐鲁工业园区,653100,喀什地区,650000,新疆维吾尔自治区,"39.420837,76.032264"
1189,伊犁沛林汽车销售有限公司,0999-7869999,新疆伊宁市巴彦岱中亚汽车博览中心,654000,伊犁哈萨克自治州,650000,新疆维吾尔自治区,"43.977875,81.23604"
709,阿勒泰地区华越升汽车销售服务有限公司,0906-3908880,新疆北屯西北路S319省道4公里处,654300,阿勒泰地区,650000,新疆维吾尔自治区,"44.4027897,84.92354707"
655,石河子市恒通吉成汽车销售服务有限公司,0993-7657777,新疆石河子市36小区东一路军垦汽车城186-3号,659000,自治区直辖县级行政区划,650000,新疆维吾尔自治区,"44.28807233,86.05937858"
