id,name,telphone,address,city-region,city,province-region,province,place
638,北京雅胜天成汽车销售有限责任公司,010-83825858,北京市丰台区小屯双林东路,110000,北京市,2,北京,"39.87877,116.2639"
693,北京广大行汽车服务有限责任公司,010-67672288,北京市朝阳区南四环东路49号,110000,北京市,2,北京,"39.840672392,116.4691371125"
786,北京汉青鸿宇商贸有限公司,010-57033993,北京市房山区城关街道顾八路一区2号,110000,北京市,2,北京,"39.71244133,116.0218965"
871,北京金佳景汽车销售有限公司,010-88452266,北京市海淀区闵庄路16号,110000,北京市,2,北京,"39.9787191,116.261923"
872,北京津丰华北汽车贸易有限公司,010-68817935,北京市石景山区古城西路63号 北京国际汽车贸易服务园区D厅,110000,北京市,2,北京,"39.921634,116.189807"
873,北京勤华瑞达汽车销售服务有限公司,010-85576735/85576738,北京市朝阳区姚家园路甲1号(东方基业汽车城内18号店),110000,北京市,2,北京,"39.946093,116.531685"
903,北京中德汽车销售有限公司,010-84918118-1,北京市朝阳区来广营西路26号,110000,北京市,2,北京,"40.027594,116.454019"
914,北京中企欣源汽车销售服务有限公司,010-63513466,北京市丰台区南三环西路43号,110000,北京市,2,北京,"39.857898,116.359856"
1145,北京鑫达汇城汽车销售服务有限公司,010-89098886,北京市密云县十里堡彩虹门北侧,110000,北京市,2,北京,"40.36287,116.803852"
1180,北京金进通汽车销售服务有限公司,010-80863599,北京市通州区永顺镇乔庄村351号,110000,北京市,2,北京,"39.894321,116.710341"
656,上海马轩汽车销售服务有限公司,021-62555559,上海市闵行区纪鹤路488号（近联友路）,310000,上海市,24,上海,"31.249854,121.263656"
762,上海红申汽车销售服务有限公司,021-50893033/ 021-50891007,上海市浦东新区航津路186号,310000,上海市,24,上海,"31.336767,121.584872"
764,上海申悦汽车销售服务有限公司,021-58586655,上海市浦东新区川沙路3295号,310000,上海市,24,上海,"31.228372,121.695871"
837,上海绅亚汽车销售服务有限公司,021-54338428,中春路（沪青平路）9998号,310000,上海市,24,上海,"31.173205,121.336101"
897,上海起亚交运汽车销售服务有限公司,021-54095588,上海市龙吴路908号,310000,上海市,24,上海,"31.157558,121.457528"
935,上海绅协绅起汽车销售服务有限公司,021-62502188,上海市普陀区真南路2165号,310000,上海市,24,上海,"31.2881199,121.371668"
936,上海东悦汽车销售服务有限公司,021-66985700,上海市宝山区江杨南路1008号,310000,上海市,24,上海,"31.331697,121.47345"
945,上海红悦汽车销售服务有限公司,021-68041177,上海市沪南路4789弄3幢304－311号(上海车市内),310000,上海市,24,上海,"31.075195,121.595912"
1019,上海明锐汽车销售服务有限公司,021-67222189,上海市金山区金山大道4298弄38号,310000,上海市,24,上海,"30.735695,121.304935"
1083,上海宝通赢汽车销售服务有限公司,021-33709280,上海市宝山区月罗路1563号,310000,上海市,24,上海,"31.422976,121.381436"
1107,上海弘宇汽车销售服务有限公司,021-37572000,上海市奉贤区南桥镇环城西路1488号,310000,上海市,24,上海,"30.9622564,121.449532"
1181,上海红诚汽车销售服务有限公司,021-31272200,上海市嘉定区江桥镇翔江公路1699号,310000,上海市,24,上海,"31.042486,121.732281"
761,天津市宇东达亚汽车贸易有限公司,022-68623000,天津市静海开发区金海道2号,120000,天津市,25,天津,"38.953779,117.006186"
796,天津利源祥汽车销售有限公司,022-82843333,天津蓟县中昌南路翠屏山路口西,120000,天津市,25,天津,"40.002885,117.424847"
831,奥嘉起亚（天津）商贸有限公司,022-27909111 022-27909333,天津市西青区中北镇卉康路5号（天津汽车城）,120000,天津市,25,天津,"39.122091,117.095214"
874,天津银诺威臣汽车销售服务有限公司,022-26725959,天津市北辰区新宜白大道南,120000,天津市,25,天津,"39.214834,117.222554"
1126,天津怡路天成汽车部件有限公司,022-23962666-8101,天津市西青区大寺开发区高新技术产业园储源道16号,120000,天津市,25,天津,"38.999646,117.279168"
667,重庆市国亚汽车销售有限公司,023-47589555,重庆市江津区德感街道德感工业园区B-08,500000,重庆市,31,重庆,"29.269396,106.238565"
699,重庆华威腾亚汽车销售服务有限公司,023--67605515,重庆市江北区南桥寺盘溪路304号,500000,重庆市,31,重庆,"29.596258,106.490298"
731,重庆辰宇鑫亚汽车销售有限公司,023-44599999,重庆市潼南县创业大道99号,500000,重庆市,31,重庆,"30.15498,105.825458"
777,重庆协信宏亚汽车销售服务有限公司,023-62417777,重庆市巴南区渝南大道20号（龙洲大道西部国际汽车城5号楼旁）,500000,重庆市,31,重庆,"29.481175,106.565263"
810,重庆康安起悦汽车销售有限公司,023-87169888,重庆市永川区昌州大道中段629号,500000,重庆市,31,重庆,"29.367162,105.90754"
834,重庆渝亚汽车销售服务有限公司,023-88109888,重庆市九龙坡区石新路176号,500000,重庆市,31,重庆,"29.527694,106.461559"
888,重庆市现代高新汽车服务有限公司,023-86300808,重庆市经济技术开发区白鹤路100号,500000,重庆市,31,重庆,"29.520899,106.562401"
889,重庆中汽西南韩亚汽车有限公司,023-89112828,重庆市北部新区金渝大道99号附6号,500000,重庆市,31,重庆,"29.646554,106.578122"
1022,重庆商社启迪汽车销售服务有限公司,023-86888333,重庆市北部新区华园路一巷1号2幢第1层至第2层,500000,重庆市,31,重庆,"29.6096268,106.566807"
1032,重庆商社起航汽车销售服务有限公司,023-58666699,重庆市万州区万全小区A-9区沙龙路三段,500000,重庆市,31,重庆,"30.768489,108.394475"
1082,重庆互邦互恒汽车销售服务有限公司,023-72209777,重庆市涪陵区鹅颈关10号,500000,重庆市,31,重庆,"29.7158947,107.367942"
1239,重庆正腾起悦汽车销售服务有限公司,023-85138666,重庆市合川区北部汽车园,500000,重庆市,31,重庆,"29.9451220000,106.2873570000"
1243,秀山县华盛汽车销售服务有限公司,023-87985777,重庆市秀山县中和街道花灯大道武陵汽博中心,500000,重庆市,31,重庆,"28.4648470000,109.0266930000"
765,河北天巧汽车贸易有限公司,0311-67260599,石家庄市北二环与建华大街交口国际汽车贸易园北门南行1000米路西,130100,石家庄市,130000,河北省,"38.076532,114.55582"
877,石家庄润丰汽车贸易有限公司,0311-87711118,石家庄市北二环西路328号（北二环与西三庄大街交叉口路南）,130100,石家庄市,130000,河北省,"38.0916013,114.456649"
878,河北合众汽车贸易有限公司,0311-85071222,河北省石家庄市裕华区南二环与富强大街交叉口西行50米路北,130100,石家庄市,130000,河北省,"38.007879,114.528547"
815,唐山悦众汽车销售服务有限公司,0315-5116661,唐山市西外环机场路立交桥北侧荣川汽车园区,130200,唐山市,130000,河北省,"39.677113,118.112742"
875,唐山冀东东风悦达起亚汽车销售服务有限公司,0315-2863878,唐山市路南区复兴路与吉祥路交叉口南行500米,130200,唐山市,130000,河北省,"39.600686,118.204008"
1036,唐山庞大龙华庆汽车销售服务有限公司,0315-5253777,唐山市开平新城道口南行200米路东,130200,唐山市,130000,河北省,"39.661937,118.268322"
1142,迁安庞大华泓汽车销售有限公司,0315-5351555,迁安市迁安镇丰安大路2106号,130200,唐山市,130000,河北省,"39.984634,118.741281"
803,秦皇岛凯通汽车销售有限公司,0335-8881111,河北省秦皇岛市经济开发区秦皇西大街293号,130300,秦皇岛市,130000,河北省,"39.92387,119.493006"
948,秦皇岛新秦东风悦达起亚汽车销售服务有限公司,0335-5307777,河北省秦皇岛市经济技术开发区峨眉山路以西新管委西对面,130300,秦皇岛市,130000,河北省,"39.945871,119.535647"
600,邯郸市宇泰汽车贸易有限公司,0310-5625187,邯郸市邯山区东环路与邯大路交叉口西行100米路北,130400,邯郸市,130000,河北省,"36.561254,114.533792"
879,邯郸市华达汽车销售服务有限公司,0310-5760558,邯郸市渚河路西头4号路北,130400,邯郸市,130000,河北省,"36.594653,114.479517"
1028,邯郸市华旗汽车销售服务有限公司,0310-5708181,河北省邯郸市丛台区北环路与中华大街交叉口东行500米路南,130400,邯郸市,130000,河北省,"36.66082,114.511009"
944,邢台市华悦汽车贸易有限公司,0319-3227111/ 0319-3227222,邢台市迎宾路世纪名都西侧,130500,邢台市,130000,河北省,"37.111354,114.538022"
640,保定致悦汽车销售服务有限公司,0312-5891111,保定市东三环与东风路交叉口南行800米路东,130600,保定市,130000,河北省,"38.861016,115.567762"
642,高碑店市起悦汽车贸易有限公司,0312-6557111,河北省高碑店市112线老看守所东行150米路南,130600,保定市,130000,河北省,"39.344164,115.896057"
763,定州市双悦汽车贸易有限公司,0312-2100555,河北省定州市定曲路保定工业学校路西500米路北,130600,保定市,130000,河北省,"38.556072,114.928287"
876,保定市广龙东风悦达起亚汽车贸易服务有限公司,0312-7916770/771/5903116,保定市朝阳北大街1288号,130600,保定市,130000,河北省,"38.909549,115.474075"
990,保定庞大龙华庆汽车销售服务有限公司,0312-8015533,保定市朝阳路最南端清苑庞大汽车城,130600,保定市,130000,河北省,"38.757269,115.495408"
1164,涿州市辉致汽车销售服务有限公司,0312-3766888,涿州市桃园办事处半壁店村西南（西邻107国道）,130600,保定市,130000,河北省,"39.454726,115.970109"
671,张家口天行汽车贸易有限公司,0313-5036288,河北省张家口市张宣公路沙岭子大市场南1公里东侧,130700,张家口市,130000,河北省,"40.678797,114.940702"
952,张家口市鹏程汽车贸易有限责任公司,0313-4566988,河北省张家口市高新区玉宝墩北100米,130700,张家口市,130000,河北省,"40.761194,114.916373"
1043,承德庞大龙华庆汽车销售服务有限公司,0314-5921555,承德市大石庙镇太平庄村二化厂东南侧,130800,承德市,130000,河北省,"40.89549209,117.9930579"
660,黄骅市骅腾汽车销售服务有限公司,0317-8880969/,河北省黄骅市城西老307国道北侧南王曼村南,130900,沧州市,130000,河北省,"38.361286,117.29252"
1044,沧州庞大龙华庆汽车销售服务有限公司,0317-3086666,河北省沧州市开发区石港路30号,130900,沧州市,130000,河北省,"38.294887,116.935886"
686,廊坊博鼎汽车销售有限公司,0316-5550777,河北省廊坊市广阳区廊万路189号(长征驾校西200米),131000,廊坊市,130000,河北省,"39.551866,116.657106"
911,廊坊市悦众信达汽车销售有限公司,0316-2399077,廊坊市东环路19号,131000,廊坊市,130000,河北省,"39.509667,116.745438"
827,衡水龙杰汽车销售服务有限公司,0318-7602888,桃城区北外环路武警教导队对面,131100,衡水市,130000,河北省,"37.775588,115.717846"
993,山西福瑞沃汽车销售服务有限公司,0351-6329300,太原市长风西大街18号长风汽贸城西区,140100,太原市,140000,山西省,"37.824898,112.530544"
1021,山西大昌N亚汽车销售服务有限公司,0351-7998686,太原市平阳南路88号（大昌立体4S店二层）,140100,太原市,140000,山西省,"37.789979,112.557744"
1162,山西唐悦汽车销售有限公司,0351―5271000,太原市新晋祠路36号汇豪新能源汽车城（市交警支队北200米路西）,140100,太原市,140000,山西省,"37.831435,112.534958"
767,大同市迪捷汽车销售服务有限公司,0352-5038888,山西省大同市南郊区南环路西延段庞大汽车文化园林广场20号,140200,大同市,140000,山西省,"40.04752,113.26081"
882,大同市胜翔汽车销售服务有限公司,0352-7919618,大同市开发区汽车城十字路口西北角,140200,大同市,140000,山西省,"40.072271,113.410163"
1048,阳泉戴美克汽车贸易有限公司,0353-2160866,山西省阳泉市郊区李荫路黄砂岩段东风悦达起亚4S店,140300,阳泉市,140000,山西省,"37.917242,113.579074"
805,长治市飞路臣信汽车销售服务有限公司,0355-6082221 ,山西省长治市西二环2号（北寨十字路口300米）,140400,长治市,140000,山西省,"36.217579,113.080318"
918,长治市港友汽贸服务有限公司,0355-2207555,山西省长治市英雄北路206号,140400,长治市,140000,山西省,"36.225002,113.132606"
675,晋城市唐悦汽贸有限公司,0356-8886299,山西省晋城市城区泽州北路4848号（公交公司对面）,140500,晋城市,140000,山西省,"35.525484,112.859629"
967,晋城市瑞昌汽车销售有限公司,0356-2051501,晋城市中原街661号,140500,晋城市,140000,山西省,"35.482678,112.869781"
1090,朔州市宏昌汽贸有限公司,0349-8858000,山西省朔州市开发区海天海酒店东500米路南,140600,朔州市,140000,山西省,"35.482805,112.86993"
1233,晋中悦驰汽车销售服务有限公司,0354-3956811,山西省晋中开发区汇通路秋村段省交通学院对面,140700,晋中市,140000,山西省,"37.757784,112.671959"
771,河津市瑞远汽车销售有限公司,0359-5066999,运城市机场大道中段诺维兰汽车公园内,140800,运城市,140000,山西省,"35.071693,111.033203"
910,运城市万通车城汽车销售有限公司,0359-5796222,山西省运城市盐湖工业园区大运高速路口对面,140800,运城市,140000,山西省,"35.096449,110.968084"
1237,山西诺维兰集团运城瑞悦汽车销售有限公司,0359-2582666,运城市机场大道中段诺维兰汽车公园内,140800,运城市,140000,山西省,"35.0716930000,111.0332030000"
661,忻州市碧玉泉新华夏汽车连锁销售有限公司,0350-3612666,山西省忻州市开发区国家电网东500米管委会斜对面,140900,忻州市,140000,山西省,"38.471873,112.734795"
828,临汾亚悦汽车销售服务有限公司,0357-5787333 ,临汾市霍侯一级路屯里村口,141000,临汾市,140000,山西省,"36.131609,111.538386"
902,临汾市诺维兰汽车销售服务有限公司,0357-2596668,临汾市尧都区尧庙村南(临汾艺校对面),141000,临汾市,140000,山西省,"36.048127,111.498146"
1225,侯马市恒辛汽车销售有限公司,0357-4029777,山西省临汾市侯马新田东路亚欧桥市场A2栋,141000,临汾市,140000,山西省,"35.634738,111.433072"
1158,吕梁厚生汽车销售服务有限公司,0358-8351133,山西省吕梁市离石区交口镇聚富汽贸园,141100,吕梁市,140000,山西省,"37.505613,111.099133"
648,内蒙古广汇汇通汽车销售有限公司,0471-8906622,呼和浩特市金川开发区汇金道2号亿阳汽车城院内,150100,呼和浩特市,150000,内蒙古自治区,"40.804535,111.562649"
880,内蒙古东风悦达起亚汽车销售有限责任公司,0471-2217999,内蒙古呼和浩特市新城区成吉思汗大街东段3号,150100,呼和浩特市,150000,内蒙古自治区,"40.8654082,111.694453"
1097,呼和浩特市庞大华泓汽车销售服务有限公司,0471-8925999,呼和浩特市回民区海西路红旗小学对面,150100,呼和浩特市,150000,内蒙古自治区,"40.824179,111.610582"
881,内蒙古祥达汽车销售服务有限责任公司,0472-2601596,包头市开发区友谊大街34号,150200,包头市,150000,内蒙古自治区,"40.6499613,109.877655"
1174,包头市金祥瑞汽车销售服务有限公司,0472-5217888,包头市青山区民族东路与110国道交汇处往东150米,150200,包头市,150000,内蒙古自治区,"40.707872,109.867192"
1079,乌海市骏豪汽车销售有限公司,0473-2225333,内蒙古乌海市海勃湾区林荫大道南，沃野路西,150300,乌海市,150000,内蒙古自治区,"39.706145,106.842611"
775,赤峰大成汽车贸易有限公司,0476-5970011,赤峰市红山区桥北物流园区赤锡路130号,150400,赤峰市,150000,内蒙古自治区,"42.322648,118.943145"
1207,翁牛特旗易坤汽贸有限公司,0476-6359333,内蒙古赤峰市翁牛特旗乌丹镇城乡贸易中心东风悦达起亚易坤特约店,150400,赤峰市,150000,内蒙古自治区,"42.93093,118.998921"
980,通辽市大鹏誉达汽车贸易有限公司,0475-8883335,通辽市经济技术开发区瑞丰汽贸物流园L1区,150500,通辽市,150000,内蒙古自治区,"43.656508,122.227802"
986,鄂尔多斯市祥达汽车销售服务有限责任公司,0477-8101927,东胜区铜川镇汽车博览园东风悦达起亚4S店,150600,鄂尔多斯市,150000,内蒙古自治区,"39.794224,110.114263"
1230,鄂尔多斯市美悦欣汽车销售服务有限公司,0477-4853173,内蒙古鄂尔多斯市准格尔旗薛家湾镇呼大公路118公里,150600,鄂尔多斯市,150000,内蒙古自治区,"39.9252860000,111.2902380000"
826,呼伦贝尔市大鹏汽车贸易有限公司,0470-8988886,呼伦贝尔市鄂温克旗巴彦托海镇海伊公路东侧大鹏汽车城,150700,呼伦贝尔市,150000,内蒙古自治区,"49.121383,119.757825"
1124,巴彦淖尔市祥达汽车销售服务有限公司,0478-8288161,巴彦淖尔市临河区临五路与朔方路十字路口西500米,150800,巴彦淖尔市,150000,内蒙古自治区,"40.791268,107.452973"
1080,乌兰察布市声荣汽车销售有限公司,0474-3603988,集宁新区车管所往南200米,150900,乌兰察布市,150000,内蒙古自治区,"40.952158,113.186336"
1091,兴安盟骏驰汽车维修有限公司,0482-8395100,兴安盟科尔沁右翼前旗政府新址天骄路道东,152200,兴安盟,150000,内蒙古自治区,"46.10668,122.016834"
633,锡林郭勒盟天成路安汽车销售服务有限公司,0479-6918777,锡林浩特市火车站南600米路西,152500,锡林郭勒盟,150000,内蒙古自治区,"43.919002,116.043092"
692,沈阳路丰源汽车销售服务有限公司,024-31484888,沈阳市浑南新区浑南西路127号起亚路丰源,210100,沈阳市,210000,辽宁省,"41.72978,123.406484"
901,辽宁世家汽车销售服务有限公司,024-25635666,沈阳市铁西区北二中路19号,210100,沈阳市,210000,辽宁省,"41.81605,123.374706"
1063,沈阳庞大龙华庆汽车销售服务有限公司,024-31690001/0008,辽宁省沈阳市浑南新区文汇街9号,210100,沈阳市,210000,辽宁省,"41.752672,123.516579"
746,瓦房店市新世纪汽车贸易有限公司,0411-85589966,辽宁省瓦房店市钻石街2177号,210200,大连市,210000,辽宁省,"39.595201,121.942331"
659,鞍山市中悦汽车销售服务有限公司,0412-8401111,鞍山市铁西区达道湾鞍刘路建设大道西,210300,鞍山市,210000,辽宁省,"41.166544,122.954058"
922,鞍山市逸方汽车销售服务有限公司,0412―8222222,辽宁省鞍山市铁东区建国大道1204号,210300,鞍山市,210000,辽宁省,"41.082898,122.968727"
1171,抚顺广联达东郡汽车销售服务有限公司,024-54650666,辽宁省抚顺市东洲区青年路东段17号,210400,抚顺市,210000,辽宁省,"41.871936,124.019936"
1067,锦州汇通汽车销售服务有限公司,0416-3801222,辽宁省锦州市中央南街5号,210700,锦州市,210000,辽宁省,"41.091821,121.146136"
670,营口远宏汽车贸易有限公司,0417-7941111/ 0417-7942222,辽宁省营口市鲅鱼圈区青龙山大街东鑫发15号,210800,营口市,210000,辽宁省,"40.276447,122.184866"
1055,营口市老边区艺鑫佳盛汽车贸易有限公司,0417-2928888/2941111,辽宁省营口市老边区太和庄东外环交通物流南200米,210800,营口市,210000,辽宁省,"40.669098,122.292672"
997,阜新鑫汇通汽车销售服务有限公司,0418-2981666,辽宁省阜新市经济开发区海青路45号,210900,阜新市,210000,辽宁省,"41.991913,121.606569"
1100,辽阳市中悦汽车销售服务有限责任公司,0419-3992888,辽阳市太子河区胜利路79号(富虹酒店南800米),211000,辽阳市,210000,辽宁省,"41.263505,123.144109"
995,盘锦融达信汽车销售服务有限公司,0427-3219123,辽宁省盘锦市兴隆台区辽河南路东和锦汽车街,211100,盘锦市,210000,辽宁省,"41.113624,122.055333"
1131,朝阳久泰汽车贸易有限公司,0421-7200000,辽宁省朝阳市龙城区工业园区,211300,朝阳市,210000,辽宁省,"41.606228,120.401334"
1183,葫芦岛路赛得实业有限公司,0429--2678999,辽宁省葫芦岛市国家专利技术园区高新9路,211400,葫芦岛市,210000,辽宁省,"40.737569,120.799119"
766,长春瑞乘起亚汽车销售服务有限公司,0431-81235777,长春市宽城区海尔大道与兴旺路交汇,220100,长春市,220000,吉林省,"43.984767,125.29357"
835,吉林同泽汽车销售服务有限公司,0431-81202777,吉林省长春市经济开发区东南湖大路2679号,220100,长春市,220000,吉林省,"43.859109,125.399311"
883,吉林省瑞德汽车贸易集团有限公司,0431-87036666,长春市高新技术开发区硅谷大街3900号,220100,长春市,220000,吉林省,"43.819689,125.25826"
999,长春市新鸿达汽车销售服务有限公司,0431-82761111,长春市基隆路817号,220100,长春市,220000,吉林省,"43.929883,125.28581"
996,吉林市金来汽车贸易有限公司,0432-66086666,吉林市哈达湾开发区珲春北街16号,220200,吉林市,220000,吉林省,"43.884027,126.533547"
1244,吉林市汇金车业有限公司,0432-62141111,吉林市龙潭区华丹大街588号,220200,吉林市,220000,吉林省,"43.9431140000,126.5622080000"
1176,四平市铭晟达汽车贸易有限公司,0434-6963818/6963828,吉林省四平市铁东经济开发区奋进汽车厂东行500米,220300,四平市,220000,吉林省,"43.133002,124.463007"
1218,吉林省涵博汽车销售服务有限公司,0434-6274499,吉林省四平市公主岭市新102国道999公里处涵博汽车销售服务有限公司,220300,四平市,220000,吉林省,"43.881355,125.278885"
1149,通化市鸿达汽车销售有限公司,0435-3580000,吉林省通化市东昌区环通乡长流村303国道旁,220500,通化市,220000,吉林省,"41.782925,125.919317"
1203,梅河口市广达汽车销售服务有限公司,0435-4513222,吉林省通化市梅河口市北环路长城汽贸院内,220500,通化市,220000,吉林省,"42.546488,125.69732"
1053,前郭县大为汽车销售服务有限公司,0438-2887888,吉林省松原市工业园区成吉思汉大街888号,220700,松原市,220000,吉林省,"45.1059022,124.888389"
747,白城市大为汽车销售服务有限公司,0436-5868888,吉林省白城市经济开发区洮白公路888号,220800,白城市,220000,吉林省,"45.581725,122.839222"
776,延吉起亚汽车维修服务有限公司,0433-2663012,吉林省延吉市朝阳街2568号,222400,延边朝鲜族自治州,220000,吉林省,"42.926155,129.533545"
1012,延吉中诚广丰汽车贸易有限公司,0433-2450722,延吉市长白山东路3809号,222400,延边朝鲜族自治州,220000,吉林省,"42.905392,129.587998"
884,黑龙江亿发汽车销售服务有限公司,0451-84328999,哈尔滨市道里区机场路12号,230100,哈尔滨市,230000,黑龙江省,"45.7117482,126.559267"
1060,哈尔滨庞大祥盛汽车销售服务有限公司,0451―51837555,黑龙江哈尔滨先锋路18号,230100,哈尔滨市,230000,黑龙江省,"45.780935,126.764087"
668,齐齐哈尔市尊远汽车销售服务有限公司,0452-8888296/,齐齐哈尔市龙沙区喜庆路1号,230200,齐齐哈尔市,230000,黑龙江省,"47.309315,123.975683"
1038,齐齐哈尔市东域汽车销售有限责任公司,0452-8888266,齐齐哈尔铁锋区联通大道汽贸城309-1号,230200,齐齐哈尔市,230000,黑龙江省,"47.350082,124.076433"
905,鸡西市吉顺达汽车销售有限公司,0467-6113388,黑龙江省鸡西市桥北开发区新建材广场2号,230300,鸡西市,230000,黑龙江省,"45.264829,130.94166"
748,鹤岗市荣达汽车销售有限公司,0468--3319688,鹤岗市东山区东方红乡兴华村,230400,鹤岗市,230000,黑龙江省,"47.334709,130.353337"
806,大庆中保汽车销售服务有限公司,0459-6999898,大庆市萨尔图区祥阁汽配城新兴东街10号,230600,大庆市,230000,黑龙江省,"46.569412,125.164163"
1112,大庆欧意尔石油机械设备有限公司,0459-5679999/5679666,黑龙江大庆市开发区庆新大街12号,230600,大庆市,230000,黑龙江省,"46.599791,125.054918"
907,牡丹江市凯禾汽车贸易有限公司,0453-6665444, 牡丹江市阳明开发区矿山东路西兴业路北东风悦达起亚4S店,231000,牡丹江市,230000,黑龙江省,"44.627672,129.68103"
1170,绥化市圣亚润达汽车销售服务有限公司,0455-8156868,黑龙江省绥化市经济技术开发区88号,231200,绥化市,230000,黑龙江省,"46.593237,126.993153"
727,江苏省苏舜金江汽车销售服务有限公司,025-57757188,南京市六合经济开发区龙兴路,320100,南京市,320000,江苏省,"32.314186,118.812718"
818,南京黄埔汽车销售有限责任公司,025-84866555/ 025-84815118,南京市玄武区珠江路659号,320100,南京市,320000,江苏省,"32.052026,118.820009"
830,南京金起汽车销售服务有限公司,025-86303266,南京市鼓楼区虎踞北路98号,320100,南京市,320000,江苏省,"32.084992,118.760495"
1033,江苏悦达骏驰汽车销售有限公司,025-58220108,江苏省南京市浦珠北路133号,320100,南京市,320000,江苏省,"32.11869,118.712034"
1113,南京起淳汽车销售服务有限公司,025-68817888,江苏省南京市高淳县淳溪镇汶溪路163-16（苏皖汽车城）,320100,南京市,320000,江苏省,"31.344667,118.87458"
1182,南京乐豪汽车销售服务有限公司,025-56235586,江苏省南京市溧水县经济开发区岔路口,320100,南京市,320000,江苏省,"31.689416,119.023907"
755,江阴市南华车辆服务有限公司,0510-81663100/ 0510-81663966,江阴市夏港国际汽车城1688-6号,320200,无锡市,320000,江苏省,"31.906411,120.204776"
